id,handle,text,is_retweet,original_author,time,lang,retweet_count,favorite_count
780916180899037184,HillaryClinton,"Last night, Donald Trump said not paying taxes was ""smart."" You know what I call it? Unpatriotic. https://t.co/t0xmBfj7zF",True,timkaine,2016-09-27T23:45:00,en,2445,5308
780911564857761793,HillaryClinton,Couldn't be more proud of @HillaryClinton. Her vision and command during last night's debate showed that she's ready to be our next @POTUS.,True,POTUS,2016-09-27T23:26:40,en,7834,27234
780874710049550336,HillaryClinton,3) Has Trump offered a single proposal to reduce the friction of starting a business. @HillaryClinton has https://t.co/OhFAFEFsUq,True,mcuban,2016-09-27T21:00:13,en,1087,2824
780869063648153601,HillaryClinton,"The election is just weeks away. Check if you're registered to vote at https://t.co/HcMAh8ljR0, only takes a few cl… https://t.co/H1H7hAA4XM",True,ddlovato,2016-09-27T20:37:47,en,3347,7698
780819344553107456,HillaryClinton,So. Everything you're feeling after #Debates2016? It's #NationalVoterRegistrationDay. PLEASE:… https://t.co/YnOtJL8bW7,True,shondarhimes,2016-09-27T17:20:13,en,1328,2435
780806581650878464,HillaryClinton,Register and vote for Democrats like @HillaryClinton and @KatieMcGintyPA: https://t.co/tu6W6eS9xR #iRegistered… https://t.co/9ovdecqadN,True,JoeBiden,2016-09-27T16:29:30,en,1235,3206
780805211472486401,HillaryClinton,I've been fortunate to meet young Americans from all over the country. We all make choices. This is mine...… https://t.co/bYoUE91TOO,True,AndrewJenks,2016-09-27T16:24:03,en,804,2086
780800117867683841,HillaryClinton,"Today is #NationalVoterRegistrationDay - I was beaten, left bloody &amp; unconscious so that every person could register and vote. Do your part.",True,repjohnlewis,2016-09-27T16:03:49,en,20006,24333
780799428269670400,HillaryClinton,More than 70 million Americans aren't registered to vote. We have to do better! Get registered &amp; spread the word: https://t.co/IobF5PQ7jv,True,jasoncollins98,2016-09-27T16:01:04,en,1138,1554
780637326921830400,HillaryClinton,"Tonight, @HillaryClinton proved she is ready to be President — and Donald Trump proved he is not. #debatenight https://t.co/Zeq5iF09Bc",True,JoeBiden,2016-09-27T05:16:56,en,10733,30012
780616114120294400,HillaryClinton,.@timkaine That's what we @Wellesley girls do! And it's so clear @HillaryClinton is the only candidate prepared to be president #debatenight,True,madeleine,2016-09-27T03:52:39,en,3229,10833
780607486516690944,HillaryClinton,Hillary Clinton did what she needed to do: https://t.co/OhN5ZjCu2G https://t.co/4P3f6pNXB3,True,TheAtlantic,2016-09-27T03:18:22,en,2277,6913
780606592337252352,HillaryClinton,"Tonight, we heard from two candidates -- but only one president. #ImWithHer",True,ChadHGriffin,2016-09-27T03:14:49,en,7576,20896
780606012667691008,HillaryClinton,"""Hillary won big time. It was a shut out."" -- @HardballChris #debatenight",True,hardball,2016-09-27T03:12:31,en,4682,12991
780603720191148032,HillaryClinton,Clinton won this debate in part because she had more stamina for this than Trump. He flagged badly after 30 minutes. She didn't.,True,ezraklein,2016-09-27T03:03:24,en,8546,22141
780593967737999361,HillaryClinton,"Donald Trump says he has better temperament than Hillary Clinton.

Fact check: He is Donald Trump. 

#debate",True,TheBriefing2016,2016-09-27T02:24:39,en,5646,10367
780592014639456256,HillaryClinton,This is... still not true! #debate https://t.co/6SKFZunCL5,True,TheBriefing2016,2016-09-27T02:16:53,en,1387,2339
780591186046222336,HillaryClinton,Trump's top Russia advisor is being probed for meeting with the Kremlin aide in charge of US election intelligence.  https://t.co/GN5Gg4ug0L,True,TheBriefing2016,2016-09-27T02:13:36,en,1213,1638
780589100483145728,HillaryClinton,This is just one of the business practices that led to Donald Trump being sued for discrimination. #Debate… https://t.co/PoXvMnGfCy,True,TheBriefing2016,2016-09-27T02:05:18,en,1523,1946
780585761309659136,HillaryClinton,How Hillary Clinton Took Charge In The First Presidential Debate https://t.co/4gwtCnACV0,True,BuzzFeedBen,2016-09-27T01:52:02,en,1259,2676
780581355633700864,HillaryClinton,"No legit reason @realDonaldTrump can't release returns while being audited, but if scared, release earlier returns no longer under audit.",True,MittRomney,2016-09-27T01:34:32,en,11973,15567
780579726389809152,HillaryClinton,"In the spirit of friendship, here's Donald Trump's ISIS plan for your consideration. #debate https://t.co/YCXFWZyiGA",True,TheBriefing2016,2016-09-27T01:28:03,en,4128,5914
780576756713549824,HillaryClinton,"Donald Trump seems to think $15 million is a ""small loan."" #debate https://t.co/Bo3HOhdR92 https://t.co/K5bCPX3ujx",True,TheBriefing2016,2016-09-27T01:16:15,en,1738,2478
780575993593524224,HillaryClinton,How many Trump products were made overseas? Here’s the complete list. https://t.co/OdJOZeZau0,True,washingtonpost,2016-09-27T01:13:13,en,1656,1563
780528788102864896,HillaryClinton,Study: Donald Trump would raise taxes on millions of middle-class families https://t.co/NmTl8m1R1G https://t.co/INemC8Roms,True,oneVoxdotcom,2016-09-26T22:05:39,en,1505,1763
780472397694693376,HillaryClinton,Hillary Clinton has a $10 billion plan to stop the heroin epidemic. Donald Trump has some slogans. https://t.co/tN8jGGWrvn,True,voxdotcom,2016-09-26T18:21:34,en,1218,2365
780427115325980672,HillaryClinton,"This job takes maturity, compassion, and wisdom. Only one candidate has what it takes. #DebateNight https://t.co/TAA1qZUdtq",True,timkaine,2016-09-26T15:21:38,en,2967,7022
780149449171603456,HillaryClinton,The NYT Editorial Board says Donald Trump should not be president. Here's why. https://t.co/aQ0NZm19Hx via @nytopinion,True,nytimes,2016-09-25T20:58:17,en,4288,5959
780146068990357508,HillaryClinton,Take it from those who have been there - Trump is not ready for the responsibility of being president: https://t.co/MCmcwcOwju,True,JoeBiden,2016-09-25T20:44:51,en,7563,12670
780094699264770048,HillaryClinton,This war hero's Gold Star parents want you to know why they're backing .@HillaryClinton for president… https://t.co/6vEh87N02B,True,MilitaryTimes,2016-09-25T17:20:44,en,1516,2897
780088306314928128,HillaryClinton,"Once again, Trump's own words are the best evidence he's not fit to be president. https://t.co/D3Ox56zt1k",True,TheBriefing2016,2016-09-25T16:55:20,en,2620,4385
779714455525556224,HillaryClinton,The NYT Editorial Board endorses Hillary Clinton for president https://t.co/aSQ7lkaR6w via @nytopinion https://t.co/Zm4O1AcVS2,True,nytimes,2016-09-24T16:09:47,en,4585,8232
779485052216471552,HillaryClinton,Tell a girl to run - for office! #DeclareYourAmbition at https://t.co/Gcthrb8QwO https://t.co/AAIOYi1hFA,True,IGNITE_National,2016-09-24T00:58:13,en,1464,2652
779453173610213376,HillaryClinton,"I wouldn't tolerate anyone talking to my daughter like that, and she wouldn't either. https://t.co/ZExu0ZacWS",True,timkaine,2016-09-23T22:51:32,en,10548,19228
779428731228196864,HillaryClinton,"The Enquirer editorial board is endorsing Hillary Clinton for president, breaking a nearly century-long tradition of endorsing Republicans.",True,Enquirer,2016-09-23T21:14:25,en,3141,5148
779409689876566016,HillaryClinton,I’ve released 9 years of tax returns. RT if you agree it’s time for Donald Trump to release his! https://t.co/08whtFVC0r,True,tedcruz,2016-09-23T19:58:45,en,8721,7853
779335288283947008,HillaryClinton,Every Voice is proud to endorse @HillaryClinton for president. https://t.co/S30v1eZtCm https://t.co/2YUAG4wPJu,True,EveryVoice,2016-09-23T15:03:06,en,1165,2521
779311437663600641,HillaryClinton,"Editorial board: Clinton would be a smart, pragmatic president. Trump would be a catastrophe.… https://t.co/GVsU7ogGPO",True,latimes,2016-09-23T13:28:20,en,4876,7833
778976591770714112,HillaryClinton,Holding back tears right now. For those of us that didn't grow up with #ADA this is amazing. #imwithher #CripTheVote,True,RachaelGass,2016-09-22T15:17:46,en,452,1293
778957908990189568,HillaryClinton,.@HillaryClinton sits down Between Two Ferns with Zach Galifianakis for her most memorable interview yet. https://t.co/169e3KxEyE,True,funnyordie,2016-09-22T14:03:32,en,28387,45833
778765262933880832,HillaryClinton,Trump mocks people with disabilities. Hillary Clinton wants to expand their job opportunities https://t.co/GuuwvJgwER,True,YoungPwD4HRC,2016-09-22T01:18:02,en,1572,3188
778705291168755712,HillaryClinton,"Happy anniversary! 4 years ago today, Romney released his 2011 tax returns (which Trump urged him to do). Where are… https://t.co/Aho8vMnwSP",True,TheBriefing2016,2016-09-21T21:19:43,en,3404,4540
778670400830070784,HillaryClinton,The ADA and the notion that workplaces and public spaces belong to everyone was one that Democrats and Republicans could both get behind.,True,HFA,2016-09-21T19:01:05,en,478,1444
778669685474811904,HillaryClinton,One of Hillary's first jobs out of law school was to find out why kids with disabilities weren't in school. https://t.co/vPMCYQmbls,True,HFA,2016-09-21T18:58:14,en,1075,2031
778669114063806464,HillaryClinton,"Not that long ago, if you had a disability, it defined your entire life. Basic, essential things that others could do, you couldn’t.",True,HFA,2016-09-21T18:55:58,en,501,1468
778668146966335488,HillaryClinton,"It's still legal to pay disabled workers less than the minimum wage and Clinton announces her plan to end that:
https://t.co/vEgIqMkmmg",True,feministabulous,2016-09-21T18:52:07,en,1517,2648
778292079231377408,HillaryClinton,NEW: @realdonaldtrump used more $250K+ from his charity to pay off legal settlements of his for-profit businesses.   https://t.co/Fa1RooYWMT,True,Fahrenthold,2016-09-20T17:57:46,en,10825,8957
778254419678859265,HillaryClinton,"Trump cannot be trusted with his own charity, but we are supposed to believe he can manage the nation’s treasury? https://t.co/DtX6C7Rftb",True,SenatorReid,2016-09-20T15:28:07,en,4292,5681
778251997019537408,HillaryClinton,"""Our identities do not have to be defined by putting someone else down but can be enhanced by lifting someone else up"" —@POTUS at #UNGA",True,WhiteHouse,2016-09-20T15:18:29,en,2448,4935
778063499956195329,HillaryClinton,"""No one has the right to immigrate to this country."" —Donald Trump during his rally in Florida today

We disagree. https://t.co/9gS9q5vQS9",True,HillaryforOH,2016-09-20T02:49:28,en,1911,3464
777952999100522496,HillaryClinton,"When @HillaryClinton says she’s going to make public colleges and universities tuition-free, you know what? That's a very big deal.",True,BernieSanders,2016-09-19T19:30:23,en,5661,15689
777914352884146176,HillaryClinton,Go to https://t.co/SvSvlg48vI and register to vote today. Register your friends. Register everyone you know.,True,HFA,2016-09-19T16:56:49,en,841,1446
777911385200230400,HillaryClinton,No one gets through life alone. We have to look out for each other and lift each other up. https://t.co/FEStrnjjOO,True,HFA,2016-09-19T16:45:01,en,801,1835
777910791110623232,HillaryClinton,"""No one will work harder to make your life better. I’ll never stop, no matter how tough it gets."" —Hillary https://t.co/TyXrp8PgsW",True,HFA,2016-09-19T16:42:40,en,840,1910
777889026661556224,HillaryClinton,"Not only is @realDonaldTrump wrong on birtherism, his words and policies are bad for Americans alive now and our children yet to be born.",True,RevDrBarber,2016-09-19T15:16:11,en,786,1898
777868477310918656,HillaryClinton,"Want to do a small part to help defeat Trump in November? RT this link and get everyone registered, and confirmed. https://t.co/1R7UN7e0a0",True,GeorgeTakei,2016-09-19T13:54:31,en,4478,3625
777858612727250948,HillaryClinton,.@HillaryClinton wrote for us about what millennials have taught her during this election: https://t.co/SlMZZ1C19f https://t.co/qNUEzbQeYR,True,mic,2016-09-19T13:15:19,en,1446,2507
777642761579270144,HillaryClinton,We've got 51 days left to win this thing. Make sure you're ready: https://t.co/B21QKpeiSj https://t.co/nZTkkuxtDP,True,timkaine,2016-09-18T22:57:36,en,2642,7182
777636788814880770,HillaryClinton,FACT: The @ClintonFdn spends 87% on its life changing work: https://t.co/z0zW4Axdbc https://t.co/GtI94aBp4m,True,ClintonFdn,2016-09-18T22:33:52,en,1449,2725
777605055834890242,HillaryClinton,"So, what do the candidates’ foundations do again? https://t.co/PVrx1SeUxs",True,TheBriefing2016,2016-09-18T20:27:47,en,2731,4336
777578838498873344,HillaryClinton,"When we stand together - as white, black and hispanic, gay and straight, women and men - we trump hate. https://t.co/B8aVUwudDc",True,BernieSanders,2016-09-18T18:43:36,en,4515,9680
777195717978910720,HillaryClinton,"When your friends say they won't vote, ask how much student debt they have. There's only one candidate who will make college affordable.",True,BernieSanders,2016-09-17T17:21:13,en,5019,11284
776799805964255232,HillaryClinton,"It's been 5 years, and Trump's still pushing the notion that @POTUS isn't American. https://t.co/TApNqSOcvN",True,timkaine,2016-09-16T15:08:00,en,2592,4372
776796015466807296,HillaryClinton,My dad was born in Poland. Do you know how many people ever asked me whether or not I was born in America? Nobody ever asked me that.,True,SenSanders,2016-09-16T14:52:56,en,49195,104428
776606300738314244,HillaryClinton,Immigrants aren’t somehow changing the American character; immigrants are the American character. https://t.co/S2vtM157TI,True,WhiteHouse,2016-09-16T02:19:05,en,2684,5324
776536090643689472,HillaryClinton,Celebrating #HispanicHeritageMonth with @HillaryClinton's quotes read by @DNCLatinos. 🇺🇸 https://t.co/BEPgn0hQNd,True,Jorge_Silva,2016-09-15T21:40:06,en,1407,2384
776530140998295553,HillaryClinton,"Love this.

""@HillaryClinton has spent her life fighting for children—here are 8 ways she’s changed their lives."" 

https://t.co/7goGIa0Ag0",True,SenGillibrand,2016-09-15T21:16:27,en,2194,3923
776484189977837568,HillaryClinton,People have seen almost 40 years of tax returns from Hillary. One set from Trump really isn't too much to ask. https://t.co/K3oyDiIUlq,True,timkaine,2016-09-15T18:13:51,en,3624,6551
776454788645003264,HillaryClinton,"An unsurprising Nazi reference from the ""alt-right"" movement's presidential campaign. This is the real Trump. https://t.co/HOUgRC8343",True,Evan_McMullin,2016-09-15T16:17:02,en,3212,3881
776407898238877696,HillaryClinton,".@HillaryClinton stands by @RealDonaldTrump running a deplorable campaign.  His comments have been bigoted, mean and untrue.",True,TJMShow,2016-09-15T13:10:42,en,757,2112
776248216597721088,HillaryClinton,"Congratulations to Carla Hayden, sworn in today as 14th #LibrarianOfCongress! Follow her at @LibnOfCongress https://t.co/d6cyBNEfUV",True,librarycongress,2016-09-15T02:36:11,en,634,1652
776231971022376960,HillaryClinton,This is the America I believe in-Beautiful. Multifaceted. Loving. Inclusive. This is why I'm passionate https://t.co/ia363mFPv8 #WeTrumpHate,True,SophiaBush,2016-09-15T01:31:38,en,1092,2716
776210505300054016,HillaryClinton,"People are making less real wages than 18 years ago, Trump says in Ohio. ""Me, I’m working harder also so I don’t feel sorry for any of you.""",True,JenniferJJacobs,2016-09-15T00:06:20,en,2856,3370
776146554277289988,HillaryClinton,Attention lawyers &amp; law students: Help @HillaryClinton protect the right to vote. Sign up &amp; share with your friends: https://t.co/FPdlNX35BF,True,marceelias,2016-09-14T19:52:13,en,1010,1517
776138180517040129,HillaryClinton,Hillary applauds the agreement on a new memorandum of understanding regarding U.S. security assistance to Israel. https://t.co/NDnDsVKODP,True,rosenbergerlm,2016-09-14T19:18:56,en,635,1506
776127586564968448,HillaryClinton,Hillary Clinton has some questions for Donald Trump after reading that @Newsweek article. https://t.co/jfyKQFBpFL,True,TwitterMoments,2016-09-14T18:36:51,en,2368,3210
776051645297913856,HillaryClinton,In @Newsweek: A Pres Trump could not conduct US foreign policy w/o affecting his personal bank account.  https://t.co/A1Xw4IlxUX,True,kurteichenwald,2016-09-14T13:35:05,en,2240,2744
776047278364758016,HillaryClinton,"In @Newsweek: Trump Organization business would place national security at risk, even undermining the war on ISIS. https://t.co/A1Xw4IlxUX",True,kurteichenwald,2016-09-14T13:17:44,en,2328,2935
776042470836695040,HillaryClinton,Our latest cover story: Trump's foreign ties could upend U.S. national security interests https://t.co/44RNvOMham https://t.co/3sXNDP3HNE,True,Newsweek,2016-09-14T12:58:37,en,4481,4817
775848325199323136,HillaryClinton,"Like most of Trump’s plans, the details of his paid leave proposal aren't serious. https://t.co/os0sznIEju",True,TheBriefing2016,2016-09-14T00:07:09,en,1158,1883
775795472732659712,HillaryClinton,Why @HillaryClinton is the best choice to lead the US economy (via @AndreaJung9) https://t.co/Ij9chfRugD #election2016,True,CNBCopinion,2016-09-13T20:37:08,en,2119,3708
775740736868323328,HillaryClinton,Every woman in this country deserves to be free from harm and from fear. Proud to celebrate 22 years of the Violence Against Women Act. -Joe,True,JoeBiden,2016-09-13T16:59:38,en,3520,9472
775714298966450176,HillaryClinton,.@HillaryClinton's HBCU plan is really smart. Addresses so many critical issues around access &amp; debt. I'm impressed. https://t.co/KqmOIek5II,True,texasinafrica,2016-09-13T15:14:35,en,469,1117
775422234148175882,HillaryClinton,"🎓 Tuition
📚 Books
🏡 Room and board
🍕 Food
College adds up. @HillaryClinton wants to help you save: https://t.co/uRn5JlFs8u",True,CollegeDems,2016-09-12T19:54:01,en,615,1403
775391163243237376,HillaryClinton,Leading charity watchdogs agree: the work of the @ClintonFdn earns the highest marks across the board. https://t.co/wOqMvnnUNS,True,ClintonFdn,2016-09-12T17:50:34,en,1665,3218
775359954349879296,HillaryClinton,"Senator Tim Kaine: ""Everyone deserves affordable higher education"" https://t.co/unC6d07poy",True,TIME,2016-09-12T15:46:33,en,833,2079
774794852798193664,HillaryClinton,reading https://t.co/CfsnQUUZ77 makes me excited to vote for @HillaryClinton with the next generation in mind 🐣 https://t.co/niKY8H1PIM,True,tyleroakley,2016-09-11T02:21:02,en,1942,8220
774779998553145344,HillaryClinton,".@ClintonFdn: 4/4 stars from @CharityNav

Trump Fdn: Fined by the IRS for illegal political donation
https://t.co/sVWBWZbjjM",True,TheBriefing2016,2016-09-11T01:22:01,en,2237,3122
774726490835607552,HillaryClinton,".@realdonaldtrump once used $20,000 of his charity's money to buy a six-foot-tall painting of...himself. https://t.co/PyskO1LtLC",True,Fahrenthold,2016-09-10T21:49:23,en,7060,6701
774701341084151808,HillaryClinton,"If Donald Trump wins, kids lose. https://t.co/TvQS8jWqYy",True,USNewsOpinion,2016-09-10T20:09:27,en,1301,2017
773990251140411393,HillaryClinton,"When it comes to mental health, help should be focused on treatment, not judgment. https://t.co/IG5sP5qpbG",True,timkaine,2016-09-08T21:03:50,en,1289,3333
773919776355848194,HillaryClinton,Hillary Clinton is supporting a bill that would protect benefits for former coal miners https://t.co/4gLC6U1swR https://t.co/ZCahhAvT9Q,True,businessinsider,2016-09-08T16:23:48,en,1112,1818
773904330990714880,HillaryClinton,"The House should reject H.R. 5424, which rolls back important rules on Wall Street money managers and puts workers’ retirements at risk.",True,mikereedschmidt,2016-09-08T15:22:25,en,488,1098
773897081828306945,HillaryClinton,"Donald Trump ""absolutely"" stands behind his horrible 2013 tweet about sexual assault in the military https://t.co/c7mAsS1a06",True,nowthisnews,2016-09-08T14:53:37,en,1670,1899
773714580421873664,HillaryClinton,"Trump to Matt Lauer on Iraq: ""I was totally against the war."" Here's proof Trump is lying: https://t.co/6ZhgJMUhs3 https://t.co/PJXG20q9LJ",True,voxdotcom,2016-09-08T02:48:25,en,3140,3842
773694664960577536,HillaryClinton,"Trump's unpresidential trifecta tonight:
1. Attack our generals
2. Praise Putin
3. Blame women in combat for sexual assault
#NBCNewsForum",True,brianefallon,2016-09-08T01:29:17,en,8082,10884
773693758265262080,HillaryClinton,Trump tried to prove he'd be fit to serve as president...by comparing @POTUS unfavorably to Putin. #NBCNewsForum https://t.co/zCZ0NfYcTT,True,TheBriefing2016,2016-09-08T01:25:41,en,1864,2700
773692233744785409,HillaryClinton,I really can't believe I just saw a Republican nominee for president heap praise on a thuggish Russian leader while denigrating our military,True,morningmoneyben,2016-09-08T01:19:37,en,6667,10234
773685017042096128,HillaryClinton,"Donald Trump's super secret plan to fight ISIS is still a super secret. #NBCNewsForum 
https://t.co/SBbCVgeaQD",True,TheBriefing2016,2016-09-08T00:50:57,en,858,1615
773684718202187776,HillaryClinton,A man who talks about our veterans and military families like this doesn't deserve to be Commander-in-Chief. https://t.co/4s6SvAAyNA,True,HillaryClinton,2016-09-08T00:49:45,en,4156,8944
773681680397860864,HillaryClinton,"In 2002, Donald Trump said he supported invading Iraq https://t.co/B3071OFSQy https://t.co/On1ZfL88eC",True,BuzzFeed,2016-09-08T00:37:41,en,1512,1799
773678952992894977,HillaryClinton,"Unlike her opponent, Hillary's plan to defeat ISIS is not a secret. #NBCNewsForum https://t.co/oD3OtTss9z",True,TheBriefing2016,2016-09-08T00:26:51,en,753,1476
773668180355055616,HillaryClinton,A person who trash talks our own military should never set foot in the Oval Office. https://t.co/h04p4QF1xz,True,timkaine,2016-09-07T23:44:02,en,2895,6212
773666123896225792,HillaryClinton,"""We must be a force for unity in America, for a vision that includes all of us."" —Gen. John Allen at the DNC https://t.co/AyI3H0mrdd",True,HFA,2016-09-07T23:35:52,en,420,1154
773660205162852352,HillaryClinton,Trump's pay-to-play scandal revolves around the Trump U scam which preyed on people like this military family. https://t.co/LvUwpPsDOr,True,TheBriefing2016,2016-09-07T23:12:21,en,1794,2190
773630924433068032,HillaryClinton,RT if you believe Donald Trump's actions speak louder than his empty words. https://t.co/VcLIIDNQdJ,True,timkaine,2016-09-07T21:16:00,en,4940,6341
773573415487889408,HillaryClinton,"1. Download our app
2. Complete daily challenges
3. Elect the next president

https://t.co/neivbRsKF8",True,HFA,2016-09-07T17:27:29,en,294,714
773489172904550400,HillaryClinton,We recommend @HillaryClinton for U.S. president https://t.co/eWtGJexQqz https://t.co/CazHEkM2pX,True,dallasnews,2016-09-07T11:52:44,en,4752,8149
773310415824617472,HillaryClinton,GOP cares more about defunding @PPFA and protecting the Confederate flag than protecting millions from Zika: https://t.co/89NlkqAERw,True,sarajacobs89,2016-09-07T00:02:25,en,859,1450
773001872022114305,HillaryClinton,Stronger together. https://t.co/6qmOJ39K56,True,timkaine,2016-09-06T03:36:22,en,3251,11643
772942682570317828,HillaryClinton,"While the Clinton Foundation receives high marks, Trump's is fined for a pay-to-play scheme https://t.co/RBfz9qQ1Vp https://t.co/XTc1QqhSjZ",True,TheBriefing2016,2016-09-05T23:41:10,en,2505,3452
772923560021094400,HillaryClinton,21 years ago @HillaryClinton's speech pushed the political discourse and forced a global dialogue on gender equality https://t.co/ie6q5yfytF,True,LizRomanoff,2016-09-05T22:25:11,en,1265,2639
772595451698749440,HillaryClinton,We need better community resources for the 1 in 4 college-aged students facing mental health challenges. https://t.co/6HgJLtHeM2,True,timkaine,2016-09-05T00:41:24,en,1740,4364
772540181777936386,HillaryClinton,Hillary Clinton has a quietly bold idea to stop drug price spikes: https://t.co/CWTgFWhnuS https://t.co/q06VjyIRUL,True,Slate,2016-09-04T21:01:47,en,794,1730
772145826579767296,HillaryClinton,"Hillary will deliver on Paris &amp; go further to cut emissions, build renewable energy to power every home in America. https://t.co/pbSfCG6md3",True,johnpodesta,2016-09-03T18:54:45,en,1492,3680
772112825724571648,HillaryClinton,There's no higher calling than service to others. https://t.co/ldZqTt3tqU,True,timkaine,2016-09-03T16:43:37,en,2001,6029
771733851542544384,HillaryClinton,".@DavidLeopold: ""Trump laid out the most hardline, mean spirited immigration proposal in U.S. history."" https://t.co/5WeGrK7DVp",True,AmericasVoice,2016-09-02T15:37:42,en,859,1418
771681710517940224,HillaryClinton,Clinton announces plan to address 'unjustified' price hikes on life-saving drugs https://t.co/rRmEOlqYNF,True,ReutersPolitics,2016-09-02T12:10:31,en,1087,2256
771519937949081604,HillaryClinton,Donald Trump's immigration plan makes it clear that he's more interested in dividing us than uniting us. https://t.co/BZTegQGGYV,True,timkaine,2016-09-02T01:27:42,en,3160,6948
771497518790283264,HillaryClinton,"Folks, we've got to elect @HillaryClinton and take back the Senate. Let's roll up our sleeves and get to work. -Joe https://t.co/7MyhWs9sAc",True,JoeBiden,2016-09-01T23:58:36,en,3505,9056
771443033246138368,HillaryClinton,This election is about looking in the mirror. Do we see a nation that respects people or divides people? https://t.co/uQZLNiBd5m,True,timkaine,2016-09-01T20:22:06,en,2941,7300
771379484721311744,HillaryClinton,"""The neighborhood you come from is where your character is etched. Where your values are set."" -VP Biden https://t.co/DQ99r0Od7e",True,JoeBiden,2016-09-01T16:09:35,en,1002,3148
771378960672387072,HillaryClinton,"""[Trump] was born with a silver spoon in his mouth that he's now choking on because his foot's in his mouth along with the spoon."" -VP Biden",True,JoeBiden,2016-09-01T16:07:30,en,8926,18360
771374345281232896,HillaryClinton,We're fighting for the middle-class workers who make America great. Follow along as VP Biden is back in Ohio today. https://t.co/lJUMetkav0,True,JoeBiden,2016-09-01T15:49:10,en,936,3100
