id,handle,text,is_retweet,original_author,time,lang,retweet_count,favorite_count
758789145615478784,HillaryClinton,It was the honor of my life to accept the Democratic nomination for vice president. I won't let you down. https://t.co/91PGJKVsHU,True,timkaine,2016-07-28T22:20:04,en,3156,15394
758785580054503428,HillaryClinton,Watch Michael Bloomberg sum up a whole lot about that's wrong with Donald Trump in less than a minute: https://t.co/KbMtJkr3h9,True,TheBriefing2016,2016-07-28T22:05:54,en,1330,2603
758651570120716288,HillaryClinton,"To: @POTUS
From: All of us https://t.co/swH52dLR6f",True,HFA,2016-07-28T13:13:24,en,4606,12692
758491193785225216,HillaryClinton,Hillary's ready because of her heart. She's ready because of her experience. She's ready because she knows we're stronger together.,True,timkaine,2016-07-28T02:36:07,en,1573,4372
758491138084904960,HillaryClinton,"""We better elect the candidate who's proven she can be trusted with the job. The candidate who’s proven she’s ready for the job."" —Tim",True,timkaine,2016-07-28T02:35:54,en,805,2796
758490562701864960,HillaryClinton,"""Folks, you cannot believe one word that comes out of Donald Trump's mouth.""",True,timkaine,2016-07-28T02:33:36,en,1390,3824
758490116859973633,HillaryClinton,"Thousands of Trump University students believed Donald Trump when he said he would help them succeed.  

They all got stiffed.",True,timkaine,2016-07-28T02:31:50,en,1259,3363
758488587448963072,HillaryClinton,"Remember Karla, the little girl we heard from on Monday who feared her parents would be deported? She trusts Hillary to keep them together.",True,timkaine,2016-07-28T02:25:45,en,650,2318
758487742284042240,HillaryClinton,"""Republican senators...once they've made sure nobody is listening, will tell you how fantastic a senator that Hillary Clinton was.” —Tim",True,timkaine,2016-07-28T02:22:24,en,1197,3205
758486408914804736,HillaryClinton,"“I had to steer my state through the deepest recession since the 1930s, but hey, tough times don't last—tough people do.” —Tim",True,timkaine,2016-07-28T02:17:06,en,815,2629
758485938045464576,HillaryClinton,"""If any of you are looking for that Party of Lincoln, we've got a home for you right here in the Democratic Party!"" —Tim",True,timkaine,2016-07-28T02:15:14,en,1607,3944
758485209771864064,HillaryClinton,"""I took a year off law school to volunteer with Jesuit missionaries in Honduras. I taught kids welding &amp; carpentry."" https://t.co/ZwVtH9VKsN",True,timkaine,2016-07-28T02:12:20,en,2150,6216
758484379148558336,HillaryClinton,"""I humbly accept my party's nomination to be vice president of the United States!"" —Tim https://t.co/aCUajLy29q",True,timkaine,2016-07-28T02:09:02,en,1813,6092
758483865396621312,HillaryClinton,"""I want to thank my beautiful wife Anne and my three wonderful children: Nat, Woody and Annella."" —Tim https://t.co/kJuJuLXaM6",True,timkaine,2016-07-28T02:07:00,en,1110,4547
758461156805582848,HillaryClinton,"What matters in politics is if you can deliver results—and Hillary gets results. Grateful for the chance to serve.
https://t.co/iCrZfb0J5l",True,timkaine,2016-07-28T00:36:45,en,1196,3230
758460120636465152,HillaryClinton,I've seen Hillary in the Senate &amp; the Situation Room. Clear-eyed. Steady. Understands working people. Exactly the leadership we need. –Joe,True,JoeBiden,2016-07-28T00:32:38,en,2291,6639
758460105880993792,HillaryClinton,"It’s good to be back, folks. We've got less than 4 months until Election Day, and I need you with me. Let's go elect some Democrats. –Joe",True,JoeBiden,2016-07-28T00:32:35,en,2810,8658
758451939386527744,HillaryClinton,"We have had #enough of the unrelenting gun violence in America. It's time for us to fight back, together. #ImWithHer https://t.co/e8Yqfdl5Lm",True,ChrisMurphyCT,2016-07-28T00:00:08,en,1904,4151
758449896173232130,HillaryClinton,"Christine Leinonen is a symbol of strength for all Americans, especially #LGBT people. My heart is with her and her son, Drew. #Pulse",True,dominiclowell,2016-07-27T23:52:01,en,444,1452
758439187532148736,HillaryClinton,"""Maybe one day she'll look back and say, 'I was there...when we nominated our first female president.'"" —Janet, NMI https://t.co/9Q2cfCwNR1",True,HFA,2016-07-27T23:09:28,en,843,3496
758438742478716933,HillaryClinton,Just tuning into tonight's action? Watch the livestream at https://t.co/z995BLo6rF #DemsinPhilly #DNCinPHL https://t.co/A3DDTkjATG,True,DemConvention,2016-07-27T23:07:41,en,274,684
758435372921651200,HillaryClinton,"""Hillary Clinton may be our 1st woman president. But she will not be our last. Once that barrier falls, it will never... be put back up.""",True,emilyslist,2016-07-27T22:54:18,en,631,1955
758421052913483776,HillaryClinton,So proud to tell #DemsInPhilly last night why @HillaryClinton is still the best darn changemaker I've ever known. https://t.co/pgjj8jMme5,True,billclinton,2016-07-27T21:57:24,en,5454,24608
758411675716489216,HillaryClinton,Daniel Driffin is the first speaker living with HIV to take the #DemConvention stage in 12 years https://t.co/4zLHmIM2Ry,True,HRC,2016-07-27T21:20:08,en,1104,3162
758379625709961216,HillaryClinton,People are sharing photos of their grandmas celebrating Hillary Clinton’s nomination https://t.co/qmIeGOtfPb https://t.co/qdbQ1e7lVS,True,BuzzFeed,2016-07-27T19:12:47,en,2046,5613
758362318224982017,HillaryClinton,Taking it all in. https://t.co/SbCe01DOlD,True,timkaine,2016-07-27T18:04:01,en,1587,7869
758352595396268032,HillaryClinton,"""The first time that a major presidential candidate has actively encouraged a foreign power to conduct espionage."" https://t.co/bpJjsvAVlU",True,rosenbergerlm,2016-07-27T17:25:22,en,3909,4978
758339891314974722,HillaryClinton,A few thoughts from @FLOTUS that seem particularly relevant right now.  https://t.co/FgRTjWYUjl,True,TheBriefing2016,2016-07-27T16:34:54,en,795,1889
758333642456309761,HillaryClinton,.@realDonaldTrump the Hotel Roanoke AC is fine &amp; you should pay them for it. You're the one who brought the hot air! https://t.co/ReCKyjbbqG,True,timkaine,2016-07-27T16:10:04,en,2344,6083
758135135506145281,HillaryClinton,"WATCH: me + friends supporting @HillaryClinton @DemConvention #StrongerTogether #DemsinPhilly
https://t.co/0QU7KsdCka",True,ElizabethBanks,2016-07-27T03:01:16,en,10352,22672
758097752362455040,HillaryClinton,"""Hillary Clinton isn't afraid to say black lives matter..."" - Lucy McBath, mother of Jordan Davis https://t.co/kXXjsuCdgn",True,WesleyLowery,2016-07-27T00:32:43,en,1240,3462
758080121936936960,HillaryClinton,We made history. https://t.co/TBvItE7oSa,True,HFA,2016-07-26T23:22:40,en,2522,7707
758063122271891456,HillaryClinton,The #RollCallVote is underway at the @DemConvention. You can join in from home! Text HILLARY to 47246 to voice your support right now.,True,HFA,2016-07-26T22:15:07,en,428,1489
758054429744566272,HillaryClinton,It took 240 years but 2016 will be the year of the first woman POTUS!!! Great day to be an American Woman! #ImWithHer #DemsInPhilly,True,RandiBrazeau,2016-07-26T21:40:34,en,938,2992
758052292247552000,HillaryClinton,The tears are very real. Now when I tell my daughter she can be what she wants (even president) I'm not completely full of it.#WeMadeHistory,True,sjbxtr,2016-07-26T21:32:05,en,123,415
758049183001698304,HillaryClinton,Hillary's oldest delegate is 102. Read Jerry's story: https://t.co/kEFmrSaJvH https://t.co/PrH6nsn6eq,True,HFA,2016-07-26T21:19:43,en,1746,5163
758011418759294976,HillaryClinton,Meet one of our PA delegates who will help nominate @HillaryClinton today at #DemConvention: @MalcolmKenyatta https://t.co/5YaKgtd1iQ,True,HillaryforPA,2016-07-26T18:49:40,en,371,1213
757771628675751936,HillaryClinton,"""I can't see him helping anyone but himself."" —Cheryl Lankford, single mom and Trump University victim #DemsInPhilly
https://t.co/1V2emIoJUs",True,TheBriefing2016,2016-07-26T02:56:49,en,1418,2535
757764609394745344,HillaryClinton,"""We’re here today because our choice is @HillaryClinton. I’m with Hillary."" —@ElizabethforMA #DemsInPhilly https://t.co/5h4jzdGZS2",True,HFA,2016-07-26T02:28:56,en,945,2856
757757024482582528,HillaryClinton,"""Let us declare again, that we will be a free people. Free from fear and intimidation."" —@CoryBooker #DemsInPhilly https://t.co/6BoQoyqbHc",True,HFA,2016-07-26T01:58:47,en,1358,3369
757748772474654720,HillaryClinton,"No matter who you supported in the primary, we are united and stronger together. #DemsInPhilly https://t.co/C3Ynm21jKo",True,HFA,2016-07-26T01:26:00,en,1660,4066
757746637133455360,HillaryClinton,You still have a chance to be a part of history and join Hillary at the #DemsInPhilly on Thursday. Enter here: https://t.co/vWnnKOeGFP,True,HFA,2016-07-26T01:17:31,en,401,1269
757728095763824640,HillaryClinton,I cannot ever say enough how much it means to me that @HillaryClinton speaks about addiction and substance abuse. #DemsInPhilly,True,klyouell,2016-07-26T00:03:50,en,496,2075
757712714672246785,HillaryClinton,We have got to defeat Donald Trump and do everything we can to elect Hillary Clinton to the White house. #DemsInPhilly,True,BernieSanders,2016-07-25T23:02:43,en,25607,49513
757685015434014726,HillaryClinton,"The Advocate endorses @HillaryClinton, the only candidate who is a champion of #LGBT causes. https://t.co/Obq1UiVSDR https://t.co/BXErGabIqL",True,TheAdvocateMag,2016-07-25T21:12:39,en,1315,3095
757674658208546816,HillaryClinton,Hold on to your hats. The #DemConvention is just getting started: https://t.co/5HNjA2kjNP https://t.co/xSDVRj4Q4T,True,HFA,2016-07-25T20:31:30,en,528,1561
757667537022779392,HillaryClinton,"""Tim has always had a good heart."" —@SenWarren

Read what they're saying about Hillary's running mate @TimKaine: https://t.co/ZBv0nnXCOP",True,HFA,2016-07-25T20:03:12,en,485,1368
757646871343009792,HillaryClinton,"I am not able to attend this year’s Democratic convention, but I will be voting for Hillary Clinton. (1/3)",True,algore,2016-07-25T18:41:05,en,4712,11438
757252179317104640,HillaryClinton,Virginians have known and loved @timkaine for decades—and we're proud to have him on Team Hillary: https://t.co/JkfxE6jfUX,True,HillaryforVA,2016-07-24T16:32:43,en,760,2108
756883157685764097,HillaryClinton,Rania doesn't understand why a country as great as the United States has never had a woman president. #ImWithHer https://t.co/VFxkVQpIOR,True,HillaryforFL,2016-07-23T16:06:21,en,718,2309
756879404660301824,HillaryClinton,The crowd @FIU eagerly awaits for @HillaryClinton and @TimKaine to take the stage. #StrongerTogether https://t.co/MqB95knQx7,True,HillaryforFL,2016-07-23T15:51:26,en,757,2563
756689878876905472,HillaryClinton,Congrats to my friend @timkaine on being @hillaryclinton's running mate! Excited to stand w/you both &amp; fight for safer communities.,True,GabbyGiffords,2016-07-23T03:18:20,en,1858,6847
756685373208666112,HillaryClinton,My friend @timkaine brings knowledge and experience to what is already the most qualified Presidential ticket in my lifetime. 1/2,True,SherrodBrown,2016-07-23T03:00:26,en,1650,4763
756680601973952512,HillaryClinton,"He's humble.He's incredibly smart.He's a joyful warrior,a kind &amp; thoughtful person.He'll be a wonderful VP! Congrats to my friend. M. I. Z!",True,clairecmc,2016-07-23T02:41:28,en,1716,5276
756666675462860800,HillaryClinton,NARAL president @ilyseh on Hillary Clinton's VP pick @timkaine: https://t.co/q4w60GBUMg #ClintonKaine #ImWithHer https://t.co/65PqkMPdlV,True,NARAL,2016-07-23T01:46:08,en,907,1577
756665651448647680,HillaryClinton,About Tim Kaine: https://t.co/C04INo6nYF https://t.co/CM7Ufgo0TW,True,NPR,2016-07-23T01:42:04,en,3106,6262
756658991820857344,HillaryClinton,Trying to count the ways I hate @timkaine. Drawing a blank. Congrats to a good man and a good friend.,True,JeffFlake,2016-07-23T01:15:36,en,5609,13120
756652288903643136,HillaryClinton,Senator @TimKaine is a gunsense champion of the first order. https://t.co/2NTz3KV3oT,True,Everytown,2016-07-23T00:48:58,en,2030,5063
756650283334328321,HillaryClinton,Just got off the phone with Hillary. I’m honored to be her running mate. Can’t wait to hit the trail tomorrow in Miami!,True,timkaine,2016-07-23T00:41:00,en,12738,32874
756650053046075403,HillaryClinton,".@TimKaine has a big heart and showed it as a civil rights lawyer, a teacher, a mayor, a governor, and a senator. https://t.co/dT4qZ8hwL8",True,BarbaraBoxer,2016-07-23T00:40:05,en,2630,6243
756648517532286976,HillaryClinton,Virginia's own @timkaine has joined Team Hillary—now it's your turn: https://t.co/GLyVJrWn2Q #VirWINia https://t.co/Nmivj7MHYO,True,HillaryforVA,2016-07-23T00:33:59,en,1470,4176
756593980733792256,HillaryClinton,Hillary Clinton is paying respects at the Pulse nightclub memorial in Orlando https://t.co/zF6fw8sw6D,True,albamonica,2016-07-22T20:57:16,en,2059,5269
756531680626798596,HillaryClinton,"Pres. Obama on RNC: ""Some of the fears that were expressed throughout the week just don't jive with the facts."" https://t.co/zLZE4hmIT6",True,ABC,2016-07-22T16:49:42,en,2408,4252
756516146027913216,HillaryClinton,I’ve watched every moment of political conventions since 1984. Tonight I left early. I was afraid. https://t.co/Td9Uf0iVqt #RNCinCLE,True,MHarrisPerry,2016-07-22T15:47:59,en,2613,4302
756507290614788096,HillaryClinton,"""Couldn't have said it better,"" wrote the former Ku Klux Klan Grand Wizard about Trump's convention speech. https://t.co/Y1BEXlMgZs",True,JamilSmith,2016-07-22T15:12:47,en,2191,2334
756501849927258112,HillaryClinton,"Donald Trump doesn’t want to make America great. He wants to make it afraid, because that's the only way he wins:  https://t.co/8I0ubdqO1z",True,ezraklein,2016-07-22T14:51:10,en,3117,4752
756498961276530688,HillaryClinton,Leading criminologist on Trump's speech: “A good illustration of how to lie with statistics.” https://t.co/QIwd78V7ce,True,RyanLizza,2016-07-22T14:39:42,en,1718,2289
756327254549000192,HillaryClinton,Donald Trump's plan mostly benefits billionaires -- and millionaires like Donald Trump. https://t.co/KAWLrRTIhr,True,TheBriefing2016,2016-07-22T03:17:24,en,1612,2328
756325645622312960,HillaryClinton,Fixed it for you. #RNCInCLE https://t.co/2hZP2qRWNj https://t.co/9zZll0Ftr4,True,TheBriefing2016,2016-07-22T03:11:00,en,910,1658
756324241927208962,HillaryClinton,Will there be one word about student debt or making college affordable? Or just concerned about more tax breaks for the rich? #RNCwithBernie,True,BernieSanders,2016-07-22T03:05:25,en,7034,15660
756323027470716929,HillaryClinton,This is literally Donald Trump's plan to fight ISIS. #RNCinCLE https://t.co/AjxiU8Do7U,True,TheBriefing2016,2016-07-22T03:00:36,en,2722,3185
756314843376918528,HillaryClinton,Trump is just wrong about crime. #RNCInCLE  https://t.co/fQ6T44p78q https://t.co/E3ZBPqmF5Q,True,TheBriefing2016,2016-07-22T02:28:04,en,1968,2184
756314485334347776,HillaryClinton,This itself is a lie. #RNCInCLE https://t.co/jfRtBnTApa https://t.co/9oMrxWPO2n,True,TheBriefing2016,2016-07-22T02:26:39,en,1456,1905
756293254635806720,HillaryClinton,Thank you to the @NBA for standing with the LGBT community today! A big win for equality and fairness over discrimination and fear.,True,dominiclowell,2016-07-22T01:02:17,en,773,2395
756241204073857024,HillaryClinton,The only one to benefit by casting our commitment to NATO in doubt is Russia. #NATO #StandTogether,True,JohnKasich,2016-07-21T21:35:27,en,1689,3179
756214079228895232,HillaryClinton,"Happy anniversary, Dodd-Frank! One candidate would repeal Wall St reform—the other won't let it happen. Ask this guy https://t.co/2VEBblGqnK",True,mikereedschmidt,2016-07-21T19:47:40,en,593,1107
756154471307153408,HillaryClinton,BEST THING EVER. What has Donald Trump said about people like you? https://t.co/mLFq5PN7qY #TrumpYourself https://t.co/bfZSMBBxe8,True,RyanEGraney,2016-07-21T15:50:49,en,1126,1958
755963320587419648,HillaryClinton,".@mike_pence Speaking of abandoning your friends...

https://t.co/W9xQ5FHhyV",True,TheBriefing2016,2016-07-21T03:11:15,en,986,1374
755959020968636416,HillaryClinton,Pence touting Indiana's economy? It's tracked the nation's recovery because of Obama policies (auto rescue!) that Pence opposed. #RNCinCLE,True,mikereedschmidt,2016-07-21T02:54:10,en,1508,2340
755956598368047104,HillaryClinton,Mike Pence: bigotry with a heaping side of terrible economic stewardship. https://t.co/cN57UvAnjW,True,TheBriefing2016,2016-07-21T02:44:32,en,1984,2300
755951470424522752,HillaryClinton,Newt once compared Planned Parenthood to ISIS. Yeah. https://t.co/84WmkbkfTl https://t.co/aR9ILeGMCa,True,TheBriefing2016,2016-07-21T02:24:10,en,862,1161
755948952760029185,HillaryClinton,"A speaker tonight said that Donald Trump always pays his bills.

Annnd that claim just got rated false. 

#RNCINCLE https://t.co/cldMQK3gp3",True,TheBriefing2016,2016-07-21T02:14:09,en,1295,1749
755940982609285120,HillaryClinton,Ted Cruz once called Donald Trump a pathological liar. And yet...here he is. #RNCinCLE https://t.co/ZfTFm1qy5Q,True,TheBriefing2016,2016-07-21T01:42:29,en,1178,1760
755848806172794882,HillaryClinton,.@HillaryClinton is committed to working to overturn disastrous #CitizensUnited decision within her first 30 days. https://t.co/muBPctGK0s,True,SenGillibrand,2016-07-20T19:36:13,en,819,1993
755587302227898368,HillaryClinton,"Donald Trump's record of success.

 #RNCinCLE https://t.co/43UGZQfsUA",True,TheBriefing2016,2016-07-20T02:17:05,en,3776,4455
755573295865561088,HillaryClinton,But @SpeakerRyan still endorses Donald Trump for president anyway. #RNCinCLE https://t.co/Gun1FF38hZ,True,TheBriefing2016,2016-07-20T01:21:26,en,1142,1671
755572392513208320,HillaryClinton,"Mitch McConnell had a much different tune about @HillaryClinton before she ran for president. #RNCinCLE
https://t.co/ny7SUg3Ux9",True,TheBriefing2016,2016-07-20T01:17:50,en,1413,2013
755545140534583296,HillaryClinton,"Donald Trump is literally the Republican nominee for president. 
https://t.co/QOtLYcwa1l",True,literally_trump,2016-07-19T23:29:33,en,380,838
755531398283427844,HillaryClinton,"Text VOTE to 47246, register to vote, and make sure he never becomes president. https://t.co/o91O4APs8k",True,HFA,2016-07-19T22:34:57,en,1001,1612
755236725866262528,HillaryClinton,@HillaryClinton tells @charlierose Trump is the most dangerous presidential candidate in the history of this country https://t.co/5KfW6MHscR,True,CBSEveningNews,2016-07-19T03:04:01,en,3020,5789
755233922028539905,HillaryClinton,"Watch out, fog machine rental company. Trump isn't great at paying his invoices. https://t.co/kkyMEEzhKp",True,TheDemocrats,2016-07-19T02:52:53,en,2155,4373
755232142813257728,HillaryClinton,"Ret. Lt. Gen. Flynn thinks that “fear of Muslims is rational."" #RNCinCLE https://t.co/xFaVbCmfxu",True,TheBriefing2016,2016-07-19T02:45:49,en,764,1013
755229228719861760,HillaryClinton,Literally. #RNCinCLE https://t.co/LgwTgR7rOO,True,literally_trump,2016-07-19T02:34:14,en,536,1068
755217325255749633,HillaryClinton,Remember when Tom Cotton wrote a letter to the leader of Iran to undermine the Obama admin? https://t.co/AJGnM05Ts6 https://t.co/7aniq60UBT,True,TheBriefing2016,2016-07-19T01:46:56,en,1588,1627
755212277591248897,HillaryClinton,Tonight is no different than every other day in Trumplandia: he has been disparaging our community from day one.,True,lorellapraeli,2016-07-19T01:26:52,en,561,1497
755127646942556164,HillaryClinton,So this is kind of scary... https://t.co/8t63MRC9x6 https://t.co/qaCWNBd0bq,True,TheBriefing2016,2016-07-18T19:50:35,en,969,1466
754472478957772800,HillaryClinton,"Barack&amp;
Hillary&amp;
You

Join the team. https://t.co/TASO2ZKn9K https://t.co/MPEMZtVtr2",True,HFA,2016-07-17T00:27:11,en,1498,3976
754363886770487296,HillaryClinton,.@HillaryClinton pledges #campaignfinance reform plan in first 30 days! RT if you're ready to end #CitizensUnited. https://t.co/F6yV7Ni8Ym,True,StopBigMoney,2016-07-16T17:15:40,en,2443,4153
754338663128002560,HillaryClinton,"Donald Trump's VP pick Mike Pence is anti-woman, anti-LGBTQ, anti-immigrant, but pro-cigarettes  https://t.co/sODgmxFuMA",True,nowthisnews,2016-07-16T15:35:26,en,2484,2674
754337383873703936,HillaryClinton,Of COURSE @realDonaldTrump – a guy who calls women fat pigs &amp; bimbos – picked a VP who is famous for trying to control women’s bodies.,True,elizabethforma,2016-07-16T15:30:21,en,10591,19440
754336571697029120,HillaryClinton,.@realDonaldTrump and @mike_pence are a threat to all LGBTQ people have fought for. Now more than ever #ImWithHer https://t.co/45JD0aLXC6,True,ChadHGriffin,2016-07-16T15:27:08,en,1005,1704
754335659549163520,HillaryClinton,"Trump thinks he's ""great for women"" but this is one of the most anti-woman tickets in history. https://t.co/69r3jZajKp",True,UltraViolet,2016-07-16T15:23:30,en,3747,3624
754034668148822020,HillaryClinton,"Trump's VP pick #MikePence: A-rated by the NRA, accepted tens of thousands in campaign donations from the gun lobby. https://t.co/QtGkWT56RN",True,MomsDemand,2016-07-15T19:27:28,en,3037,2975
753998715959074816,HillaryClinton,"He opposes raising the minimum wage, and he really, really, really wants to privatize Social Security. https://t.co/hcE9TxdzIq",True,TheBriefing2016,2016-07-15T17:04:37,en,948,1037
753996825057779712,HillaryClinton,"Gov Pence has a long history of supporting policies attacking ppl who don’t look like him. (Anti-LGBT law, attempt to block refugee family)",True,DanMalloyCT,2016-07-15T16:57:06,en,1223,1869
753995254651641856,HillaryClinton,"Mike Pence's battle against Planned Parenthood caused an HIV outbreak in Indiana. 

https://t.co/SNGq4JcENN",True,cameronesposito,2016-07-15T16:50:51,en,3896,3259
753992638265757696,HillaryClinton,"Oh, and one time Pence wrote an op-ed titled “Smoking Doesn’t Kill.” https://t.co/5K38GlXO4Y",True,TheBriefing2016,2016-07-15T16:40:28,en,1706,1986
753991101715996676,HillaryClinton,Mike Pence wanted to use your federal tax dollars to fund more of this:  https://t.co/j90OaFM2IS,True,GavinNewsom,2016-07-15T16:34:21,en,2091,2093
753688749180084224,HillaryClinton,"11 Senate Dems &amp; I sent a letter to @usedgov, @FTC, @CFPB &amp; @DeptVetAffairs about fake schools like Trump “U”: https://t.co/HqofUVw95d",True,SenWarren,2016-07-14T20:32:55,en,1437,2973
753684287824752640,HillaryClinton,"""This is one of the most consequential elections in our history."" —@HillaryClinton. Join us: https://t.co/OieVAWguXb https://t.co/YUIVOR6iFQ",True,HillaryforVA,2016-07-14T20:15:11,en,636,1534
753642042329268226,HillaryClinton,I'm an American and I'm proud to fight for a candidate that believes we are ALL Americans #JuntosSePuede https://t.co/8KRF3RCJmO,True,lorellapraeli,2016-07-14T17:27:19,en,1014,2557
753571187356274689,HillaryClinton,In the fight to stop Donald Trump we've got a devastating tool: literally Donald Trump. Follow for a daily dose of stuff he's actually said.,True,literally_trump,2016-07-14T12:45:46,en,1404,2373
753391655600975872,HillaryClinton,On the incredibly important news of the day (or when the Democrats committed to #fixdemocracyfirst) — https://t.co/rNfE1BSp3S,True,lessig,2016-07-14T00:52:22,en,317,583
753346879707049984,HillaryClinton,BREAKING: Former Bernie Sanders supporter Braddock Mayor @JohnFetterman endorses @HillaryClinton. https://t.co/XEDjjvhnmY,True,HillaryforPA,2016-07-13T21:54:27,en,1368,2685
753261587876675584,HillaryClinton,One hashtag has been uniting people who say #ImWithHer and #FeelTheBern since December: https://t.co/bBrqPjqFMx,True,HFA,2016-07-13T16:15:32,en,476,1217
753233489122697216,HillaryClinton,"It took awhile, but we finally found a copy of Trump's speakers. https://t.co/pYloXnha5S",True,TheBriefing2016,2016-07-13T14:23:52,en,1403,3236
753219420311420928,HillaryClinton,"This from @jwpetersNYT on the hard-right GOP platform, feels like it could have been written a decade ago. Or two. https://t.co/YKciIQMs34",True,mikiebarb,2016-07-13T13:27:58,en,967,1389
753018789558624256,HillaryClinton,You cannot run for president and skip the opportunity speak on the nation's civil rights agenda. #NAACP107 https://t.co/OX60fs6ZNO,True,NAACP,2016-07-13T00:10:44,en,3034,3691
752974782593916928,HillaryClinton,Include women in the sequel. #WORK @HillaryClinton https://t.co/mRcX5GPGzs,True,Lin_Manuel,2016-07-12T21:15:52,en,5713,26644
752893413113073664,HillaryClinton,"Our job now is to see our progressive platform implemented by a Democratic Senate, a Democratic House and a Hillary Clinton presidency.",True,BernieSanders,2016-07-12T15:52:32,en,6164,10706
752886947287273472,HillaryClinton,".@HillaryClinton has won the Democratic nominating process, and I congratulate her for that. 
https://t.co/FrKbEmyuC6",True,BernieSanders,2016-07-12T15:26:50,en,3483,7577
752878415599067137,HillaryClinton,Today marks one month since the #Orlando tragedy that claimed 49 innocent lives. It is time to #StoptheHate. https://t.co/MItFDRBK98,True,HRC,2016-07-12T14:52:56,en,1542,2311
752631205665837060,HillaryClinton,PA's Senate is voting on a restrictive anti-abortion bill—HB 1948. Call your legislator &amp; urge them to vote NO now: https://t.co/YXTGZP62Hi,True,HillaryforPA,2016-07-11T22:30:37,en,382,689
752615622345981952,HillaryClinton,"""Hillary Clinton...has worked to improve the lives of Americans her entire adult life."" —@USProgressives PAC https://t.co/aRv65fqAct",True,HFA,2016-07-11T21:28:41,en,616,1456
752571600801792000,HillaryClinton,BREAKING: @CWAUnion whole-heartedly endorses @HillaryClinton for President of the United States. More: https://t.co/vo5xmRfrS7,True,CWAUnion,2016-07-11T18:33:46,en,896,1722
752552872932470784,HillaryClinton,"Remembering over 8,000 men &amp; boys massacred b/c of their faith 21 yrs ago today. #NeverForget #Srebrenica  https://t.co/N7ZVjc90nN",True,rosenbergerlm,2016-07-11T17:19:21,en,447,753
