id,handle,text,is_retweet,original_author,time,lang,retweet_count,favorite_count
751917322659586048,HillaryClinton,“We owe our children better than this. We owe ourselves better than this.” by Hillary Clinton https://t.co/sB2bIaMsT0,True,Medium,2016-07-09T23:13:54,en,1005,2455
751841224194220033,HillaryClinton,Today's proposal by @HillaryClinton is an important step toward expanding health insurance and health care access to millions of Americans.,True,BernieSanders,2016-07-09T18:11:31,en,1416,3495
751237421040275456,HillaryClinton,See new @Hillaryclinton plan to protect small biz from being stiffed by abusive companies like @realDonaldTrump's: https://t.co/6e4w0GQyOd,True,mpshapiro,2016-07-08T02:12:13,en,513,1194
750800523519983616,HillaryClinton,"""Clinton’s proposal would make public colleges tuition-free for families making less than $125,000"" https://t.co/xh69q5T2Cu",True,AustinHunt,2016-07-06T21:16:08,en,1119,2555
750739354037936132,HillaryClinton,.@realDonaldTrump fixed https://t.co/lrmn7TMnk7,True,gwenrocco,2016-07-06T17:13:04,en,2469,4214
750732760285839360,HillaryClinton,Always his only metric for success: did I make money? No matter who gets destroyed in the process.  https://t.co/aPSgG73qlr,True,jmpalmieri,2016-07-06T16:46:52,en,745,1431
750730079546769408,HillaryClinton,"""Isn't he supposed to be some kind of amazing businessman? What ... happened here?"" @HillaryClinton https://t.co/n7uCSNeI2w",True,creynoldsnc,2016-07-06T16:36:13,en,857,1592
750704039944458240,HillaryClinton,I applaud @HillaryClinton for the very bold initiative she has just brought forth for the financing of higher education.,True,BernieSanders,2016-07-06T14:52:45,en,3282,8103
750410962298105856,HillaryClinton,It's already a full house to hear from @HillaryClinton and @POTUS this afternoon in Charlotte #FirstInPOTUS https://t.co/igoTguAGnh,True,HillaryforNC,2016-07-05T19:28:10,en,513,1540
748884455419420672,HillaryClinton,Hillary's plan to connect debt relief to entrepreneurship is smart https://t.co/WjFV8Tn6tj #makersandtakers start-up rates falling since 70s,True,RanaForoohar,2016-07-01T14:22:22,en,516,1111
748684682745769984,HillaryClinton,"No presidential candidate has spent as long fighting for the rights of new Americans as Hillary Clinton. 
https://t.co/wZmpJ6ktyb",True,AmandaRenteria,2016-07-01T01:08:32,en,831,2030
748656621027491841,HillaryClinton,"As a Mexican-American, I truly fear the consequences of his anti-Mexican rhetoric. This is not funny.  https://t.co/tjAM9VIagw",True,Jorge_Silva,2016-06-30T23:17:02,en,2742,4134
748618939555524608,HillaryClinton,"BREAKING: @VP to join @HillaryClinton on the campaign trail in Scranton, PA on July 8. RSVP here: https://t.co/PaWaQ6wtOE",True,HillaryforPA,2016-06-30T20:47:18,en,722,1760
748613022348890114,HillaryClinton,Applaud Senate Dems for their strong proposal to help families fleeing violence and persecution in Central America. https://t.co/OPhFDzFsvS,True,mayaharris_,2016-06-30T20:23:47,en,364,920
748605065624170496,HillaryClinton,"WATCH: 49 celebrities pay tribute to the Orlando victims in new Ryan Murphy produced video with @HRC #StoptheHate
https://t.co/HBrccYBwun",True,HRC,2016-06-30T19:52:10,en,4013,6776
748579523474632705,HillaryClinton,Heartbroken by the heinous terrorist murder of 13-year-old Hallel Ariel. No child should be in danger in her home. https://t.co/xpN5J7871S,True,rosenbergerlm,2016-06-30T18:10:40,en,565,859
748290920513212416,HillaryClinton,We're hiring organizers across the country to bring home a win in November. Get more information and apply now: https://t.co/QMdOohEWaM,True,HFA,2016-06-29T23:03:52,en,797,1370
748281949224075264,HillaryClinton,"Hillary talks early childhood education with a teacher's son:

""Thank your mother for me, would you?""
https://t.co/exsmj1rtAU",True,HFA,2016-06-29T22:28:13,en,879,2349
748255839329390596,HillaryClinton,"Bringing on 50,000 new computer science teachers isn't just good for our kids, it's good for our economy: https://t.co/gP5SnLPyh5",True,johnpodesta,2016-06-29T20:44:28,en,404,961
748200644864053248,HillaryClinton,Today’s vote to restore Planned Parenthood funds is a victory. Well done @Maggie_Hassan &amp; the Executive Council for doing the right thing.,True,HillaryforNH,2016-06-29T17:05:09,en,608,1852
748177455630913536,HillaryClinton,Hillary and @POTUS are making their first stop together in Charlotte. Text NC to 47246 for more info on their trip! https://t.co/Bd6Om3o4Gm,True,HillaryforNC,2016-06-29T15:33:00,en,1216,3653
748162804486709248,HillaryClinton,Hillary visited 112 countries as secretary of state. Trump had products made in at least 10 as a businessman. https://t.co/mMlI7p3Hux,True,TheBriefing2016,2016-06-29T14:34:47,en,1147,1772
747852522522542080,HillaryClinton,"49 years later, we celebrate Stonewall as a national monument to the LGBT community's decades of struggle and progress.",True,dominiclowell,2016-06-28T18:01:50,en,350,1130
747841036190363648,HillaryClinton,Senate Dems are right: Public Health emergencies are not the place to inject harmful partisan policies https://t.co/EvvcqfGkyO,True,Ann_OLeary,2016-06-28T17:16:11,en,579,951
747830842823696384,HillaryClinton,"""I believe that people should have work with purpose and dignity."" @HillaryClinton explains: https://t.co/w6MlfEeGHu https://t.co/xUoPcWObAX",True,LinkedIn,2016-06-28T16:35:41,en,607,1488
747798597933105152,HillaryClinton,"Washington DC raises its minimum wage to $15 an hour, giving 114,000 working people a boost. https://t.co/3mxc8y0VMx https://t.co/SuWbHazO5h",True,EconomicPolicy,2016-06-28T14:27:33,en,489,1017
747772992999002112,HillaryClinton,Hillary Clinton wants to forgive student debt for entrepreneurs: https://t.co/d1ChO7d7WT https://t.co/83vHQ4STD1,True,WIRED,2016-06-28T12:45:49,en,930,1973
747756250100826112,HillaryClinton,"By supporting efforts to move to 100% clean energy, @HillaryClinton again showed she's the climate leader we need. https://t.co/WXiqSPwS5z",True,sierraclub,2016-06-28T11:39:17,en,497,1228
747529447679623172,HillaryClinton,It's National PTS Awareness Day and @StampOutPTSD is working to create a USPS stamp to assist those affected https://t.co/UcENICsI5v,True,jmurray20,2016-06-27T20:38:03,en,262,589
747522758289006592,HillaryClinton,"5 Things That Are Harder Than Registering To Vote, Featuring @POTUS #TurnUpToVote
https://t.co/vHfvNl3s5e",True,BuzzFeed,2016-06-27T20:11:28,en,7110,11025
747437375580704768,HillaryClinton,All smiles as we count down until @HillaryClinton and Elizabeth Warren take the stage in Cincy! #OHHillYes https://t.co/F02ycgB9N3,True,HillaryforOH,2016-06-27T14:32:11,en,564,2017
747157481672085504,HillaryClinton,.@HillaryClinton is a champion for LGBT equality. That's why #ImWithHer. 💁  Text PRIDE to 47246 if you are too! 🌈 https://t.co/8k0SHzrfqi,True,jessetyler,2016-06-26T19:59:59,en,1575,4807
747107981079252992,HillaryClinton,We're with her. https://t.co/LgbPO7CEJR,True,dominiclowell,2016-06-26T16:43:17,en,1477,4280
747098666800918529,HillaryClinton,"Make no mistake, Trump has called for a 'deportation force' that would tear families apart and deport millions. https://t.co/iI0rkw6ohR",True,lorellapraeli,2016-06-26T16:06:17,en,918,1480
747091518670921728,HillaryClinton,#DemPlatform has progressive principles &amp; high standards on trade; reflects fact many Dems believe TPP doesn’t meet bar—HRC is one of them.,True,mayaharris_,2016-06-26T15:37:52,en,364,796
747071775142453248,HillaryClinton,"For the first time, #DemPlatform explicitly calls for repealing the Hyde Amendment, which restricts women’s access to reproductive rights.",True,mayaharris_,2016-06-26T14:19:25,en,1652,3320
747071716086681601,HillaryClinton,"#DemPlatform says Americans should earn at least $15 an hour, citing NY’s min wage law &amp; calling for raising &amp; indexing federal min wage.",True,mayaharris_,2016-06-26T14:19:11,en,507,1246
747071541419065344,HillaryClinton,"For the first time ever, #DemPlatform calls for ending mass incarceration and the school-to-prison pipeline, and tackling systemic racism.",True,mayaharris_,2016-06-26T14:18:30,en,1114,2403
747071490282168320,HillaryClinton,"#DemPlatform reflects issues Hillary champions, like raising wages, immigration &amp; criminal justice reform &amp; protecting reproductive rights.",True,mayaharris_,2016-06-26T14:18:17,en,512,1178
746838705772584960,HillaryClinton,Enter for a chance to win tickets to join @HillaryClinton at @HamiltonMusical on July 12th: https://t.co/nzDJBGnVRx https://t.co/ILmt9xzEWm,True,HamiltonMusical,2016-06-25T22:53:17,en,965,3386
746707937528324096,HillaryClinton,Our thoughts and sympathies are with those impacted by #WestVirginia flooding. Please stay safe. https://t.co/9gDfW3zkJv,True,TalleySergent,2016-06-25T14:13:40,en,358,928
746369149581074432,HillaryClinton,"Asked whether he talked to any foreign policy advisors about #Brexit, Trump says “there's nothing to talk about"" https://t.co/bXpscw9w7x",True,TheBriefing2016,2016-06-24T15:47:26,en,1283,1451
746348636909506560,HillaryClinton,"For anyone shocked by Trump saying depreciation of pound is good for business, this is a person who tried to profit off the housing crisis.",True,GideonResnick,2016-06-24T14:25:56,en,3687,5471
746162023592005632,HillaryClinton,Follow along to see our 8 state Snapchat takeover! → https://t.co/v8Wnesnd9l https://t.co/yv6TDMTOPp,True,HFA,2016-06-24T02:04:24,en,276,705
745976545261543424,HillaryClinton,".@SpeakerRyan, we will not leave without acting for the victims &amp; families of reckless gun violence. #NoBillNoBreak https://t.co/eTB1WMATMd",True,repjohnlewis,2016-06-23T13:47:22,en,8913,17226
745966722834903040,HillaryClinton,"Rather than debate &amp; vote on common sense gun safety legislation, @SpeakerRyan has sent House home early for July 4 holiday #NoBillNoBreak",True,RepKClark,2016-06-23T13:08:20,en,1538,2321
745840809862381568,HillaryClinton,This is what the #gunviolence #sitin looks like frm where I'm sitting #AsLongAsItTakes #NoBillNoBreak #NoMoreSilence https://t.co/vkDxz6hgA9,True,RepDuckworth,2016-06-23T04:48:00,en,3589,7947
745839187656589312,HillaryClinton,".@SpeakerRyan, want to know a more effective way to end this sit-in? Let us vote our consciences on gun legislation! #NoBillNoBreak",True,RepJudyChu,2016-06-23T04:41:34,en,1435,3640
745827051576430592,HillaryClinton,We are waiting right now in House chamber to see if our Republican colleagues will allow a vote. #DisarmHate #sitin #EndGunViolence,True,RepBecerra,2016-06-23T03:53:20,en,844,2913
745807913286045696,HillaryClinton,They are who we're fighting for #NotOneMore  https://t.co/49XoOzKftJ,True,RepJohnLarson,2016-06-23T02:37:17,en,1062,2964
745807862077743109,HillaryClinton,Does it look like @HouseDemocrats are going anywhere?! Consider the floor held. #NoBillNoBreak https://t.co/54HL1uG9NK,True,RepTimRyan,2016-06-23T02:37:05,en,2578,6810
745807700416667648,HillaryClinton,GOP just recessed House without vote to stop suspected terrorists from getting deadly weapons or universal background checks. #NoBillNoBreak,True,RepDanKildee,2016-06-23T02:36:26,en,1262,2178
745807380772962304,HillaryClinton,"On the House floor singing ""We shall overcome someday..."" #NoBillNoBreak #holdthefloor #NoMoreSilence",True,RepYvetteClarke,2016-06-23T02:35:10,en,1152,3153
745806378883780608,HillaryClinton,We cannot give up or give in or give out. We must keep our eyes on the prize. #goodtrouble #NoBillNoBreak https://t.co/mxImON0gTj,True,repjohnlewis,2016-06-23T02:31:11,en,5417,12285
745791234615164928,HillaryClinton,We're looking for fall interns to join us at our Brooklyn HQ for the final stretch of the campaign. Apply today: https://t.co/I6JzVO4adu,True,HFA,2016-06-23T01:31:01,en,594,1185
745748208312324096,HillaryClinton,"72 yrs ago today, FDR signs the #GIBill, creating opportunity for millions of #veterans, and America too. Let's continue its lasting legacy.",True,jmurray20,2016-06-22T22:40:02,en,471,1215
745734656734138368,HillaryClinton,Let's celebrate Jo Cox's birthday by carrying on her work and her values.  She'll live on through it.  #MoreInCommon,True,rosenbergerlm,2016-06-22T21:46:11,en,386,1180
745721953709862912,HillaryClinton,"Campaign Manager Robby Mook is taking over Hillary's Instagram account today! Follow along: https://t.co/iZyxAfyeSW
https://t.co/04e5iXzGL1",True,HFA,2016-06-22T20:55:43,en,470,1314
745675370096136193,HillaryClinton,Live on Facebook: Join @HFA's @MarlonDMarshall &amp; @JessLivMo to discuss how you can get involved with the campaign → https://t.co/ZSvsI4KPzL,True,HFA,2016-06-22T17:50:36,en,217,601
745377932189831170,HillaryClinton,".@HillaryClinton
uses @realDonaldTrump's words against him in Columbus speech. https://t.co/HtkIwO2hID https://t.co/La8ZUvm09g",True,OhioPoliticsNow,2016-06-21T22:08:42,en,643,1433
745274230728720384,HillaryClinton,"Gun violence requires more than moments of silence. It requires action. In failing that test, the Senate failed the American people.",True,POTUS,2016-06-21T15:16:37,en,62341,113861
744901649878093824,HillaryClinton,"Bottom line from @MoodysAnalytics : @realDonaldTrump 's economic plans would cause a ""lengthy recession."" https://t.co/jFWnV1uLiE",True,mpshapiro,2016-06-20T14:36:07,en,602,844
744650416944779264,HillaryClinton,"At 7:41 AM Saturday, our family and hearts expanded with Aidan’s arrival. We are blessed. https://t.co/QKUMV3ls4N",True,ChelseaClinton,2016-06-19T21:57:48,en,2023,15858
744637946570149888,HillaryClinton,Aidan has made two dads very happy this Father's Day. Hillary and I are thrilled for Marc and Chelsea! https://t.co/vPuwDA3Lvr,True,billclinton,2016-06-19T21:08:15,en,4542,33791
744599286193790976,HillaryClinton,"Hillary remembers her dad on Father's Day.
https://t.co/0XQPI7FCJw",True,HFA,2016-06-19T18:34:38,en,872,2931
744332725230968832,HillaryClinton,.@Pontifex is right: Climate change hurts the vulnerable most of all. Let's care for our common home. https://t.co/aNn1TB04s9.  #LaudatoSi,True,rosenbergerlm,2016-06-19T00:55:25,en,381,975
744320093530787843,HillaryClinton,"""We've got a candidate in Hillary Clinton who is a fighter. We got one tough cookie."" —@SenWarren
https://t.co/vU6PbTlsY4",True,HFA,2016-06-19T00:05:13,en,2446,5537
744261856617914368,HillaryClinton,"I've witnessed a lot of special moments as @HillaryClinton's photographer, but June 7 was something special. https://t.co/ErQG2P6zid",True,barb_kinney,2016-06-18T20:13:48,en,978,2625
744213686814973952,HillaryClinton,"Marc and I are overwhelmed with gratitude and love as we celebrate the birth of our son, Aidan Clinton Mezvinsky.",True,ChelseaClinton,2016-06-18T17:02:24,en,3906,18824
743607998254354432,HillaryClinton,"""It's in the quiet moments you see why she does this."" Our latest ad:
https://t.co/4b5ix7RJg7",True,HFA,2016-06-17T00:55:37,en,1365,3200
743590770586820608,HillaryClinton,"6 babies born w/birth defects from Zika &amp; hundreds more pregnant women w/Zika in US, Congress STILL failing to act. https://t.co/970HCPoVLx",True,Ann_OLeary,2016-06-16T23:47:09,en,864,1008
743473378741395456,HillaryClinton,"Working people have spoken, and we proudly endorse @HillaryClinton https://t.co/V1gtQO9G6B #ShesWithUs",True,AFLCIO,2016-06-16T16:00:41,en,869,1752
743432797344370688,HillaryClinton,Proud to have @POTUS on this team. https://t.co/AHX7oyyVgg,True,HFA,2016-06-16T13:19:25,en,1166,3459
743222667847819265,HillaryClinton,Let us never forget the victims and their families. They deserve action. #OrlandoUnited #Enough #Filibuster https://t.co/2NaZXdb0k9,True,SenatorBaldwin,2016-06-15T23:24:27,en,2117,4965
743098010830143488,HillaryClinton,Donald Trump isn’t running a campaign against political correctness. He’s just running a campaign that is against being correct.,True,JesseFFerguson,2016-06-15T15:09:06,en,2173,4983
742906981946687488,HillaryClinton,"A presidential candidate just accused me and thousands of other troops of embezzlement while in a combat zone. 

https://t.co/Seiu5P0KcB",True,bkesling,2016-06-15T02:30:01,en,3349,2956
742901098739052544,HillaryClinton,Pensando en mis hermanos y hermanas. My heart is broken. In solidarity with these families. #OrlandoUnited https://t.co/lrKHGMcYDS,True,lorellapraeli,2016-06-15T02:06:39,en,335,817
742743550262136832,HillaryClinton,"LGBTQ people are Muslims, Jewish, black, Latino, women, immigrants. @realDonaldTrump's divisive rhetoric is wrong. Today especially so.",True,ChadHGriffin,2016-06-14T15:40:36,en,1481,3031
741634938718552064,HillaryClinton,The divide between @HillaryClinton &amp; Donald Trump on the environment couldn't be more clear: https://t.co/qqipW2RUS8 https://t.co/g8Abd0Gpvj,True,sierraclub,2016-06-11T14:15:22,en,1570,2708
741385713439113216,HillaryClinton,"Hey @realDonaldTrump, meet part of Hillary's policy team. We're pretty proud of her 201 pages of policy. @mpshapiro https://t.co/0eQrg3g6JC",True,mikereedschmidt,2016-06-10T21:45:03,en,1123,3409
740987694663258112,HillaryClinton,We can't wait to welcome back President Barack Obama and @HillaryClinton to Wisconsin on Wednesday! #WIBackHer https://t.co/Td6wplVCD2,True,HillaryforWI,2016-06-09T19:23:27,en,1945,6959
740938181302980608,HillaryClinton,We have to make sure climate denial does not find a home in the White House. https://t.co/MeATytYK6L,True,johnpodesta,2016-06-09T16:06:43,en,977,2479
740916661012811776,HillaryClinton,Sierra Club has endorsed @HillaryClinton for president! Read our statement: https://t.co/slDURlrx22,True,sierraclub,2016-06-09T14:41:12,en,939,2160
740653057336348672,HillaryClinton,"My 8 year old said ""See Mom, it's true, anything is possible."" #ImWithHer @HillaryClinton https://t.co/suDv0mYTzg",True,ConstanceZimmer,2016-06-08T21:13:44,en,2417,9601
740623078963707909,HillaryClinton,"This AM I told my 5-yo daughter we could elect the first woman President. She said, “OK, I’ll be the 2nd woman President then.” #HistoryMade",True,originalgriz,2016-06-08T19:14:36,en,1347,5685
740584748800704512,HillaryClinton,"Speaking is hard for me. But come January, I want to say these two words: ""Madam President."" #ImWithHer",True,GabbyGiffords,2016-06-08T16:42:18,en,4506,13182
740569020408180736,HillaryClinton,WATCH: @HillaryClinton gets emotional as she looks out over cheering crowd before her speech with @DavidMuir. https://t.co/wS1gEeChnO,True,GMA,2016-06-08T15:39:48,en,2195,5278
740392317127921665,HillaryClinton,"I keep saying Hillary is the ultimate changemaker, and tonight she proved it. I couldn't be more proud. History made. #ImWithHer",True,billclinton,2016-06-08T03:57:38,en,11149,36185
740362260154044417,HillaryClinton,"So proud of you, Mom &amp; grateful little girls can grow up knowing they can run for president  https://t.co/jgM7RbUAKQ",True,ChelseaClinton,2016-06-08T01:58:12,en,5204,16717
740163207189430272,HillaryClinton,"WATCH: @NancyPelosi tells @GMA she voted for @HillaryClinton in the #CAPrimary and is ""proud to endorse her"" https://t.co/ETTi85qA8Z",True,ABCPolitics,2016-06-07T12:47:14,en,1421,3050
739991662936608773,HillaryClinton,What she said.👇🏼 Let’s have a great turnout tomorrow! https://t.co/c76EUt3RZA,True,billclinton,2016-06-07T01:25:35,en,4313,10756
739947488631762944,HillaryClinton,"I’ve taken over @HillaryClinton's Snapchat, encouraging voters to support her in the CA primary. Add: https://t.co/ay8QEUyrwn",True,billclinton,2016-06-06T22:30:03,en,968,2902
739285982231564292,HillaryClinton,BREAKING: Clinton is projected winner in U.S. Virgin Islands Dem caucus https://t.co/Z6k6ICrFl7 #Decision2016 https://t.co/ILxoM3MGHL,True,NBCPolitics,2016-06-05T02:41:28,en,1913,4893
739268969056600064,HillaryClinton,"This is what Democrats united to beat @realDonaldTrump look like. Get ready, Donald – we're coming. https://t.co/p8dFtvr9NV",True,elizabethforma,2016-06-05T01:33:51,en,6494,16154
738875364429172736,HillaryClinton,Hillary Clinton is the better candidate to take on Trump https://t.co/vcHZmIjmgg https://t.co/hIf3ep3HMY,True,latimesopinion,2016-06-03T23:29:49,en,1542,3281
738828235757223936,HillaryClinton,Let's create jobs by making the boldest infrastructure investments since we built the interstate highway system. https://t.co/az4HVDSeM2,True,mikereedschmidt,2016-06-03T20:22:32,en,338,765
738780426916003840,HillaryClinton,The choice is clear: Hillary Clinton is the only candidate who consistently stands with gun safety. #ImWithHer https://t.co/tRcGX529cu,True,MomsDemand,2016-06-03T17:12:34,en,1098,2446
738514669569249280,HillaryClinton,"Donald Trump has never negotiated a ceasefire, but he can throw a mean pageant! https://t.co/VjJzA6AdEi",True,TheBriefing2016,2016-06-02T23:36:32,en,2281,3597
738429521934815232,HillaryClinton,"Important news. Many thanks to @WhiteHouse, @TheWCS &amp; all who played a role in this accomplishment #SaveElephants https://t.co/4389xR7kCu",True,ChelseaClinton,2016-06-02T17:58:12,en,541,1359
738177801556217856,HillaryClinton,"June is Nat'l Caribbean-American Heritage Month, recognizing the richness of #Caribbean culture &amp; strong connections that mend us together.",True,LSD_Esq,2016-06-02T01:17:57,en,312,674
738129917527887872,HillaryClinton,"As we celebrate 100 years of the @NatlParkService, Hillary has a plan to preserve America's 'best idea.'https://t.co/gqVXRZTiji",True,johnpodesta,2016-06-01T22:07:40,en,525,1114
738030030866030592,HillaryClinton,"Here's what I know. Donald Trump is a phony, a fraud. His promises are as worthless as a degree from Trump University. (1/2)",True,MittRomney,2016-06-01T15:30:45,en,14462,16949
738026531692384256,HillaryClinton,The actions of Trump University employees to prey on the poor and naive are just completely repulsive. https://t.co/Cfqp60r4U5,True,morningmoneyben,2016-06-01T15:16:51,en,737,1000
738017451636588544,HillaryClinton,"Trump U is devastating because it's metaphor for his whole campaign: promising hardworking Americans way to get ahead, but all based on lies",True,brianefallon,2016-06-01T14:40:46,en,2498,3403
737836457616871425,HillaryClinton,"A takedown of Trump's ""stunningly misguided"" views on the Paris climate deal, from the guy who negotiated it. https://t.co/6NO8Z2ovHJ",True,johnpodesta,2016-06-01T02:41:34,en,1264,1658
737788137825505281,HillaryClinton,Hillary knows she'd make history as the first woman president—and that it's about much more: https://t.co/cglSFee6xp https://t.co/N9eYf67a4R,True,TheCut,2016-05-31T23:29:34,en,771,1824
737665128250904576,HillaryClinton,Not quite! You got bad publicity for scamming vets and then lying about it. But close!  https://t.co/nLVEa6sNfC,True,creynoldsnc,2016-05-31T15:20:46,en,911,1722
737618143795875840,HillaryClinton,Major environmental group makes first ever endorsement of Hillary Clinton https://t.co/wWfuVVuuFy,True,postpolitics,2016-05-31T12:14:04,en,800,1325
736231363964219392,HillaryClinton,"If fighting for equal pay, paid leave and affordable child care is playing the ""woman card,"" well... https://t.co/qRe981zv25",True,HFA,2016-05-27T16:23:30,en,1367,2955
735961604248993792,HillaryClinton,"Because climate change has one major impact that, for Trump, is awkwardly personal... https://t.co/yckm2FtxBl",True,johnpodesta,2016-05-26T22:31:34,en,748,1051
735955545132257280,HillaryClinton,"Donald Trump says he ""cherishes women."" 

Just not if they're working and pregnant. https://t.co/sd9KHSvQlO https://t.co/MQeMLNtuNG",True,TheBriefing2016,2016-05-26T22:07:30,en,1162,1215
735943366937042945,HillaryClinton,"Brian Williams says all you need to know about the GOP nominee for president.
https://t.co/yoOoljRtau",True,creynoldsnc,2016-05-26T21:19:06,en,288,524
735627751365959680,HillaryClinton,#UAW endorses @hillaryclinton for president. https://t.co/BlOsImt7sX,True,UAW,2016-05-26T00:24:57,en,837,1412
735606072258531329,HillaryClinton,"Getting federal contractors to disclose emissions=important step for #ActOnClimate transparency. Good move, @POTUS 
 https://t.co/3pDL83jqdR",True,johnpodesta,2016-05-25T22:58:49,en,312,614
735489986200506369,HillaryClinton,"Trump bet against American families in the housing crash. Now he says its the ""kind of thinking our country needs."" https://t.co/FqdpntvDDc",True,TheBriefing2016,2016-05-25T15:17:32,en,899,1091
735131981051224064,HillaryClinton,"When Donald Trump wins, you lose. https://t.co/XrgefzxQIM https://t.co/HnZ1eL8BpJ",True,TheBriefing2016,2016-05-24T15:34:57,en,680,819
735115985699606530,HillaryClinton,"While American families suffered, Donald Trump tried to cash in. 

https://t.co/BvkHu63H1h",True,TheBriefing2016,2016-05-24T14:31:23,en,766,1004
734837083299323905,HillaryClinton,"When we work together, nothing can stand in our way. https://t.co/BAGzA36TuQ",True,HFA,2016-05-23T20:03:07,en,1137,2158
733805933801807873,HillaryClinton,Op-ed by Hillary Clinton: Child care now costs more than rent. Here’s how to fix this crisis. https://t.co/QlaR6vRCZd,True,washingtonpost,2016-05-20T23:45:42,en,930,1460
733792649996607490,HillaryClinton,"Speaking is hard for me. But come January, I want to say these two words: ""Madam President."" #ImWithHer https://t.co/8YaSpi7oL0",True,GabbyGiffords,2016-05-20T22:52:55,en,1969,3901
733720730249105408,HillaryClinton,#MichaelBrown would have been 20 years old today. My thoughts are for his mother today. #MothersoftheMovement #ChangeAgents,True,LSD_Esq,2016-05-20T18:07:08,en,594,1096
733678405837815808,HillaryClinton,"Another day, another shameful move by House GOP to roll back anti-discrimination protections for LGBT employees. https://t.co/vHXbM1JFeT",True,dominiclowell,2016-05-20T15:18:57,en,406,606
733474342324035584,HillaryClinton,"This campaign is about breaking down barriers, but this silo is pretty awesome.
https://t.co/xgI9hsen4N",True,HFA,2016-05-20T01:48:05,en,781,1909
733466016768892930,HillaryClinton,Hillary sent me to Puerto Rico to learn more about Zika. Today's Senate vote for funding to combat it is critical. https://t.co/WWr4MK3bQs,True,Ann_OLeary,2016-05-20T01:15:00,en,443,765
