id,handle,text,is_retweet,original_author,lang
744998743460569089,HillaryClinton,"You inspire me too, @ChrisMurphyCT. Let's all demand action on gun violence prevention: https://t.co/yafqJygzVf https://t.co/1Eh4uVmtmB",False,,en
744994276413628416,HillaryClinton,"Tonight, the Senate will vote on commonsense measures to prevent gun violence. Tell your senators you support them: https://t.co/ukrcuor0YJ",False,,en
744988038493769728,HillaryClinton,This is just common sense. It's time for Congress to act. https://t.co/SsJuC4D7Pm,False,,en
744982262987493376,HillaryClinton,"We owe families of gun violence victims more than prayers.

Tell your senators to act on gun violence prevention: https://t.co/v0defjTptE",False,,en
744909578907885568,HillaryClinton,A behind-the-scenes look at a historic night. https://t.co/LXO5OmgkyL https://t.co/w06yCUfbpz,False,,en
744876285730627584,HillaryClinton,Happy first day of summer. https://t.co/yfuIRFr6mG,False,,en
744714049779171328,HillaryClinton,"Gay rights are human rights and human rights are gay rights. Being LGBT does not make you less human.
https://t.co/JkWZto9fz9",False,,en
744695069777760256,HillaryClinton,You'll want to read the story behind this photo. https://t.co/Qg7hNkJQgN https://t.co/e7yO9jLF7P,False,,en
744673284059439104,HillaryClinton,"Shirley was 5 years old when women won the right to vote. Today, she's rooting for the first woman president. https://t.co/azwiTfH9th",False,,en
744629982757064705,HillaryClinton,"What a joy being with our new grandson, Aidan. So grateful. -H https://t.co/0687tOERez",False,,en
744625915792064512,HillaryClinton,Imagine if this was our president. https://t.co/DCZLKQAfqx,False,,en
744563361350844416,HillaryClinton,"They may be too young to vote, but these supporters are making their voices heard. https://t.co/LHYz7Jknhg",False,,en
744532685998161920,HillaryClinton,"Happy Father's Day, @BillClinton! https://t.co/3C2RFFuIAr",False,,en
744272825406586881,HillaryClinton,Donald Trump launched his campaign one year ago this week. And what a year it’s been. https://t.co/ag02ZD9QOP,False,,en
744221595783303172,HillaryClinton,"“I’m supporting Hillary Clinton because she’s a fighter, a fighter with guts.” —@SenWarren to the @BostonGlobe https://t.co/6MANlMY3oV",False,,en
744193553375498241,HillaryClinton,"If your business or organization is hiring and needs someone to get the job done, hire a veteran.
https://t.co/sKlNiCFtMM",False,,en
744163071074140161,HillaryClinton,"On June 18, 1983, Sally Ride became the first American woman and first LGBT astronaut to go to space. https://t.co/tT08U2WiiW",False,,en
743959844315602945,HillaryClinton,"Gun violence and hate aren't isolated—homophobia in Orlando, racism in Charleston. We need to fight them together. https://t.co/HcBJzknBz7",False,,en
743913597332500480,HillaryClinton,"In the spirit of the #Charleston9, let’s bridge our divides, fight for change, and remember that love never fails. https://t.co/VL9HAhzoTY",False,,en
743897609186742272,HillaryClinton,"We can't stop fighting until every LGBT American can live life freely, openly, and without fear. https://t.co/9XaF4l4n21",False,,en
743875582333751296,HillaryClinton,One year ago we lost 9 lives in Charleston. 49 in Orlando on Sunday. 26 in Newtown. Too many others. This has to stop. We need to change. -H,False,,en
743869620159909888,HillaryClinton,"You don't have to be LGBT to stand with the LGBT community. We all have a stake in equality. Thank you, Michael. https://t.co/EfEMVugWCp",False,,en
743842950912737281,HillaryClinton,"Donald Trump says he's ""the real friend"" of the LGBT community.

Yeah, no.
https://t.co/TWwZKC5ARS",False,,en
743804793420910592,HillaryClinton,"Trump has made a big show of supposedly supporting veterans. In reality, he's done the exact opposite. https://t.co/LipYR4dYxI",False,,en
743785125918420992,HillaryClinton,Helpful. https://t.co/zB9dY1Of3P,False,,en
743637734904958978,HillaryClinton,Hard to believe it's only been a year since Trump announced his candidacy for president. https://t.co/fYf3Kep3Qe,False,,en
743583729138995200,HillaryClinton,"""It is cruel and terrible that her life was cut short by a violent act of political intolerance"" —Hillary on Jo Cox: https://t.co/FUShBg11it",False,,en
743567954739142656,HillaryClinton,"Thank you, @SpencerJCox. Despite our differences, if we stand together, hate can never defeat us. https://t.co/3o9wyU1Ref",False,,en
743556345606057985,HillaryClinton,.@oprah Thank you. It’s an honor to have the support of someone who's shattered so many glass ceilings. https://t.co/U34EtHoYQD,False,,en
743547818011394048,HillaryClinton,"Thanks Chris, for showing what leadership looks like. I hope GOP senators take note. Looking forward to the vote. -H https://t.co/ookEqS1HMd",False,,en
743533823648894976,HillaryClinton,"Hillary helped get health care for 8 million kids. One of the first ads of the general election:
https://t.co/bkKDfo2gsA",False,,en
743507131228368896,HillaryClinton,"“Hillary Clinton has proven herself as a champion of the labor movement."" https://t.co/STSP2CRgbp",False,,en
743464285972533249,HillaryClinton,"One year ago today, @realDonaldTrump announced his campaign for president.

And what a year it's been.
https://t.co/fYf3Ke7srE",False,,en
743459396982812672,HillaryClinton,"It's absurd that people with suspected terrorist links can buy a gun in America, no questions asked. https://t.co/y0yVjO1k1K",False,,en
743273251036553217,HillaryClinton,"Belgium: Donald Trump's favorite ""city.""
https://t.co/9ASLMhAbiF",False,,en
743230014833954816,HillaryClinton,"Thank you, @SenWarren. Proud to be in this fight with you. https://t.co/2bbZ70Pidx",False,,en
743193171530813440,HillaryClinton,"An ""assault on our values""
A ""new low""
""Plays into ISIS's hands""

Newspapers react to Trump's Orlando speech: https://t.co/EiUCbx9z3r",False,,en
743172301580079105,HillaryClinton,Thousands of families are together thanks to @POTUS's action on DACA 4 years ago. We need to protect DACA/DAPA and pass immigration reform.,False,,en
743157530780655616,HillaryClinton,Some fights are too important to stay silent. Preventing gun violence is one of them. Stand strong @ChrisMurphyCT. https://t.co/LEl7iSLCgF,False,,en
743123070693449728,HillaryClinton,"Your @GOP presidential nominee responding to a terrorist attack with lies and conspiracy theories.
https://t.co/TZJmXefmx4",False,,en
743080427569741824,HillaryClinton,Donald Trump is an expert at distracting people from the fact that he has nothing substantive to say for himself. https://t.co/1ZHvalDS3R,False,,en
742917897400557573,HillaryClinton,"America has always been a country of ""we,"" not ""me."" And we've always been stronger together. https://t.co/hInlN74PFR",False,,en
742905381744218114,HillaryClinton,"Donald Trump just gave us his ""plan"" for defeating terrorism—conspiracy theories and self-congratulations. https://t.co/5tgNsWkoQh",False,,en
742894093366333440,HillaryClinton,A lot of people are saying Donald Trump is a conspiracy theorist... https://t.co/NFjHuq1ypI,False,,en
742883216105803781,HillaryClinton,"We just won Washington, D.C.! Grateful to everyone who voted. https://t.co/ImPsK42yGd",False,,en
742859429763158018,HillaryClinton,"When @BillClinton took office, @GeorgeHWBush left him a note that represents the best of our values.
https://t.co/N6dpHeF5cV",False,,en
742846428066775040,HillaryClinton,"For 241 years, brave @USArmy soldiers have answered the call to serve and protect our nation. Thank you. #ArmyBDay https://t.co/GTfNXtGwi5",False,,en
742818837817622529,HillaryClinton,".@realdonaldtrump: Attacking Muslim Americans is wrong, and it makes it harder for us to defeat terrorism. https://t.co/6aqz2PLKL2",False,,en
742796195475529728,HillaryClinton,"An attack on LGBT Americans is an attack on all Americans.
https://t.co/q4Z3kWOcPR",False,,en
742782742669185024,HillaryClinton,"RT if you're voting for Hillary today, Washington, D.C. Find your polling location here: https://t.co/m8s00nJqNP https://t.co/SlrT9HMDAu",False,,en
742775258948767744,HillaryClinton,"Today's #NetNeutrality decision is a big win for consumers, innovation, and freedom of expression on the internet: https://t.co/FcXI66zHDF",False,,en
742760897853198336,HillaryClinton,"This is one nation under God, indivisible, with liberty and justice for all. Not just for those who look or love or worship one way—for all.",False,,en
742759915576561664,HillaryClinton,"We need to work together to keep our country and our citizens safe.

None of this will be helped by anything Trump has to offer.",False,,en
742759450860257280,HillaryClinton,"People can’t board planes with full shampoo bottles—but people being watched by the FBI for terrorism can buy a gun, no questions asked?",False,,en
742759089109880832,HillaryClinton,"We need a Commander-in-Chief who can grapple with our challenges in all their complexity, with real plans that actually address them.",False,,en
742758741305614336,HillaryClinton,Trump's statements are lies—but he tells them because he has to distract from the fact that he has nothing substantive to say for himself.,False,,en
742758563328712704,HillaryClinton,"""He said I’ll abolish the 2nd Amendment. Wrong. He said I’ll let a flood of refugees into our country without any screening. Also wrong.""",False,,en
742758405845176320,HillaryClinton,"Trump's Muslim ban is wrong, dangerous, and in this instance, nonsensical. The terrorist in Orlando was born in Queens—just like Donald.",False,,en
742757846316687361,HillaryClinton,"""If Donald suggests I won’t call this threat what it is, he hasn’t been listening. 

But I will not declare war on an entire religion.""",False,,en
742757536818995200,HillaryClinton,"""It matters what we do, not just what we say. It didn’t matter what we called bin Laden—it mattered that we got bin Laden."" —Hillary",False,,en
742757215333928961,HillaryClinton,"Americans don’t need conspiracy theories and pathological self-congratulations. We need leadership, common sense, and concrete plans.",False,,en
742756974622822400,HillaryClinton,"Trump's rhetoric is shameful.

It was one thing when he was a reality TV personality. It’s another when he’s running for president.",False,,en
742756232411418624,HillaryClinton,"People of different faiths, backgrounds, sexual orientations, and gender identities are coming together to say: we won’t let hate defeat us.",False,,en
742755930736054272,HillaryClinton,"""I believe that despite those differences of opinion, we’re all on the same team...There’s more that unites us than divides us."" —Hillary",False,,en
742755560873955328,HillaryClinton,"""I believe we Americans are capable of protecting Second Amendment rights while making sure guns don’t fall into the wrong hands."" —Hillary",False,,en
742754559123161088,HillaryClinton,"Yesterday, Trump spoke about the terrorist attack in Orlando.

Watch live as Hillary responds: https://t.co/cINtBfPQUF",False,,en
742734905306681344,HillaryClinton,Gun violence prevention laws might not stop every shooting or terrorist attack—but they will save lives. https://t.co/raNqMJ4ez8,False,,en
742688472960471041,HillaryClinton,"If you’re too dangerous to get on a plane, you're too dangerous to buy a gun in America. https://t.co/jTFExp1BXF",False,,en
742552474628837376,HillaryClinton,"""I have no doubt we can meet this challenge — if we meet it together.""

Hillary's address on the Orlando attack: https://t.co/SEC6FfBQ47",False,,en
742529863496683520,HillaryClinton,"""A nightmare that’s become mind-numbingly familiar."" 

Hillary on the deadliest shooting in U.S. history: https://t.co/FSeV5aIDcU",False,,en
742482739257958400,HillaryClinton,"Weapons of war like those used in Orlando and San Bernardino have no place on our streets.
https://t.co/jTFExpjcPd",False,,en
742443337840484352,HillaryClinton,Our diversity isn’t a liability in the fight against terrorism. It’s an asset. It makes us stronger. https://t.co/0cTpmfvA3c,False,,en
742426734188990464,HillaryClinton,We have to stand together and be proud together. There is no better rebuke to the terrorists and all those who hate. https://t.co/jnFMG6J5Ac,False,,en
742410978701238272,HillaryClinton,"Our open, diverse society is an asset in the struggle against terrorism, not a liability. It makes us stronger.",False,,en
742410621354967040,HillaryClinton,"We’ve seen too many examples of the struggle to live freely, openly, and without fear being marked by violence. We have to stand together.",False,,en
742410092457406464,HillaryClinton,"""To all the LGBT people grieving today: you have millions of allies who will always have your back. I am one of them."" —Hillary",False,,en
742409706359119872,HillaryClinton,"The terrorist in Orlando targeted LGBT Americans out of hatred and bigotry. 

An attack on any American is an attack on all Americans.",False,,en
742409362593964032,HillaryClinton,"Inflammatory anti-Muslim rhetoric hurts the vast majority of Muslims who love freedom and hate terror. It’s wrong, and it's dangerous.",False,,en
742408690985226241,HillaryClinton,"Background checks and an assault weapons ban might not stop every attack—but they'll stop some, and save lives. We need to fight for them.",False,,en
742408372666912768,HillaryClinton,"In Orlando and San Bernardino, terrorists used assault weapons like the AR-15 to kill Americans. We should make it harder for them to do so.",False,,en
742407933108092929,HillaryClinton,"If the FBI is watching you for suspected terrorist links, you shouldn’t be able to just go buy a gun with no questions asked.",False,,en
742407644284092417,HillaryClinton,We need to stop terrorists from getting the weapons they need to carry out attacks. https://t.co/Q6r7VVj9ds,False,,en
742406479681064961,HillaryClinton,"""As president, I will make identifying and stopping lone wolves a top priority."" —Hillary on her counterterrorism strategy",False,,en
742405910073647104,HillaryClinton,"The murder of innocent people always breaks our hearts, scares us, and makes us furious. Now we have to steel our resolve and respond.",False,,en
742405395000528897,HillaryClinton,"""They were sons and daughters, brothers and sisters, and...they all had a lot more to give."" —Hillary on the Orlando victims",False,,en
742403983839506432,HillaryClinton,Watch live: Hillary speaks on the terrorist attack in Orlando → https://t.co/ARky5hVf9F,False,,en
742367624089194496,HillaryClinton,"""We cannot demonize, demagogue, and declare war on an entire religion...Hate is not the answer to hate."" —Hillary",False,,en
742072889860579329,HillaryClinton,"""This is a time to stand together and resolve to do everything we can to defend our communities and country."" —Hillary on the attack in FL",False,,en
742071728118059009,HillaryClinton,"""We need to keep guns like the ones used last night out of the hands of terrorists or other violent criminals."" —Hillary on the FL attack",False,,en
742070501032534017,HillaryClinton,"""To the LGBT community: please know that you have millions of allies across our country. I am one of them.” —Hillary https://t.co/MmaGjrSufr",False,,en
742069363340107777,HillaryClinton,"""This was an act of terror. ... This was also an act of hate."" —Hillary on the attack in Orlando https://t.co/MmaGjrSufr",False,,en
742068030620962817,HillaryClinton,"""I join Americans in praying for the victims of the attack in Orlando."" 

Hillary's statement: https://t.co/MmaGjrSufr",False,,en
741983463721553920,HillaryClinton,"Woke up to hear the devastating news from FL. As we wait for more information, my thoughts are with those affected by this horrific act. -H",False,,en
741788913476481024,HillaryClinton,"Donald Trump considers his shuttered casinos a success because HE made millions.

A man who thinks that way has no business being president.",False,,en
741785985567064064,HillaryClinton,"When Trump's casinos failed, he hurt a whole universe of small businesses that never got paid what they were owed. https://t.co/32cJxMhwnL",False,,en
741782496052957188,HillaryClinton,"When Trump had to make an $18 million interest payment, his dad had to bail him out by buying $3 million in chips: https://t.co/w6e1LAjOlX",False,,en
741780329606717440,HillaryClinton,"During a decade when other casinos in Atlantic City thrived, Trump's posted huge losses: https://t.co/pVE3gSW293 https://t.co/UXY1k3HBbp",False,,en
741777144485969920,HillaryClinton,Trump the businessman? A total failure. He bankrupted his Atlantic City casinos (but pocketed millions for himself): https://t.co/fxpfFotuOa,False,,en
741746495683170304,HillaryClinton,"""Sec. Clinton will be the strong environmental champion that we need to lead our country."" https://t.co/P4NqUN1qfw",False,,en
741717376845123584,HillaryClinton,"When Trump goes off his staff's script he insults anyone who challenges him. Judge for his heritage, senator for hers. Rs should disavow. -H",False,,en
741694471000072192,HillaryClinton,"Trump University: Pad Donald's pockets and put your own finances at risk—all for the low price of $35,000!
https://t.co/6NHo9RTyHz",False,,en
741684990073667585,HillaryClinton,".@realDonaldTrump is temperamentally unfit to be president and Commander-in-Chief.
https://t.co/pH28V4JWjP",False,,en
741478368676192256,HillaryClinton,"Lights, camera, history.
https://t.co/C7XFFZtz8Z",False,,en
741443616594395137,HillaryClinton,A man with this much contempt and disrespect for women has no business becoming president. https://t.co/eaOpDVixJD,False,,en
741425791825776640,HillaryClinton,".@realDonaldTrump says he’ll be “the best for women.”

Don't think so. https://t.co/zsXgf8wQF2",False,,en
741409978376957952,HillaryClinton,"""I am the least racist person that you’ve ever encountered."" —@realDonaldTrump https://t.co/9EvXSWTQGr https://t.co/smaUds8PnY",False,,en
741396683360239616,HillaryClinton,"""She’s a fighter. She’s out there. She’s tough."" —@elizabethforma on Hillary: https://t.co/ikejtwl4LW https://t.co/4xMRsOsnSh",False,,en
741378346404044800,HillaryClinton,"Trump can’t say he treats women with respect.

(For once, he’s right.)
https://t.co/eaOpDVA8Bb",False,,en
741367066385584128,HillaryClinton,"Thanks, @VP Biden! Your support is a BIG… deal. -H https://t.co/ShRoVUFocR",False,,en
741318459930349568,HillaryClinton,We’re not just going to break the glass ceiling. We’re going to break down all the barriers that hold back women and their families.,False,,en
741317714103402496,HillaryClinton,"Trump has called women “pigs,” “dogs,” and “disgusting animals.”

We can't even count on him to respect women—much less protect our rights.",False,,en
741317204143157248,HillaryClinton,"Trump says he'd be ""the best for women.""

Anyone who'd defund @PPFA and wipe out safe, legal abortion has no idea what’s best for women.",False,,en
741316543800352768,HillaryClinton,Laws that restrict access to abortion don’t make women less likely to seek it—they just make women less safe. https://t.co/vj4ZOeHq4V,False,,en
741316261087457284,HillaryClinton,"Defending women’s health means defending access to safe, legal abortion for all who need it—not just women who can afford it.",False,,en
741315915434872832,HillaryClinton,The Hyde Amendment restricts the reproductive rights of low-income women—disproportionately women of color. We need to repeal it now.,False,,en
741315271655317504,HillaryClinton,Ever notice the politicians who oppose birth control and abortion also oppose policies that make it easier to raise a child—like paid leave?,False,,en
741314267253772292,HillaryClinton,“Being able to plan their families not only saved women’s lives—it also transformed them.” —Hillary to @PPact,False,,en
741313032043782144,HillaryClinton,"""Today, I want to start by saying something you don’t hear often enough: Thank you.” —Hillary to Planned Parenthood",False,,en
741299600359890944,HillaryClinton,".@SenWarren to @Maddow: Donald Trump cannot be the one who leads the United States of America.
https://t.co/qQ2gtzhxmF",False,,en
741287661206392832,HillaryClinton,"We're hiring across the country to bring home a win in November. Apply to join our team: https://t.co/Zy7vPFrsdz
https://t.co/cyOUwBhuIq",False,,en
741284230823563264,HillaryClinton,"“I’m ready to jump in this fight and make sure that Hillary Clinton is the next president"" —@SenWarren: https://t.co/6MANlMY3oV",False,,en
741259364657463296,HillaryClinton,"Thank you, @POTUS. https://t.co/gPFJ4LZq0B",False,,en
741122964813447168,HillaryClinton,"Proud to have the support of @SenWarren—a woman who is Trump's exact opposite: honest, decent, and deeply concerned for working families. -H",False,,en
741110418807115776,HillaryClinton,"Thanks, Obama. https://t.co/DzKgMFgdmP",False,,en
741098335013113856,HillaryClinton,".@SenWarren endorsing Hillary on @maddow: ""She's a fighter.""
https://t.co/ppzKyKbCaU",False,,en
741077241409511424,HillaryClinton,"Trump ""doesn’t care who gets hurt as long as he makes a profit off it. That cannot be the person who leads the United States"" —@SenWarren",False,,en
741076353378844672,HillaryClinton,"“I’m supporting Hillary Clinton because she’s a fighter, a fighter with guts” —@SenWarren  https://t.co/ia0cfYnD3k",False,,en
741068137773305860,HillaryClinton,"""When we come together...we won’t just win in November—we’ll build on the progress we’ve made."" —@POTUS https://t.co/WJ8rdqShqx",False,,en
741055655734353920,HillaryClinton,"""I know how hard this job can be. That’s why I know Hillary will be so good at it."" —@POTUS
https://t.co/GDhRYAVn0P",False,,en
741046477183668224,HillaryClinton,Honored to have your support. https://t.co/93fTPrW1Ii,False,,en
741036783698345988,HillaryClinton,"""I’ve seen her judgment, toughness, and commitment to our values up close. ... I'm with her."" —@POTUS https://t.co/DzKgMFgdmP",False,,en
741024533059141632,HillaryClinton,"""Our elections should be shaped by voters' voices—not bought and sold by corporations &amp; special interests"" —Hillary: https://t.co/QUJomlql0N",False,,en
741018989946671104,HillaryClinton,"""On virtually every issue, Secretary Clinton stands with working Americans and their families."" —@steelworkers https://t.co/pFwAhESAq5",False,,en
740996208827731968,HillaryClinton,"""I know how hard this job can be. That’s why I know she’ll be so good at it."" —@POTUS https://t.co/RDjefd0t9f",False,,en
740982988960346112,HillaryClinton,"""I’m with her, I’m fired up, and I can’t wait to get out there and campaign for Hillary."" —@POTUS https://t.co/ptbhfpCooQ",False,,en
740973710593654784,HillaryClinton,Delete your account. https://t.co/Oa92sncRQY,False,,en
740972975680290820,HillaryClinton,"""She’s got the courage, the compassion, and the heart to get the job done.""

Watch President Obama endorse Hillary.
https://t.co/DzKgMFgdmP",False,,en
740965834470916097,HillaryClinton,"Honored to have you with me, @POTUS. I'm fired up and ready to go! -H",False,,en
740964361552941056,HillaryClinton,"President Obama endorses Hillary: ""I don’t think there’s ever been someone so qualified to hold this office."" https://t.co/KetvKoa853",False,,en
740932760550903808,HillaryClinton,"This Oakland entrepreneur is doing more than running a small business—he's changing lives.
https://t.co/2g47l5hjDX",False,,en
740921566700163072,HillaryClinton,History &gt; bedtime. https://t.co/Au3gF3dRG0,False,,en
740881580810502144,HillaryClinton,"Donald Trump's School of Philanthropy:
1. Pledge money to causes
2. Do nothing
3. Cut a check only if you get caught
https://t.co/cEpsCCrI06",False,,en
740735469021974528,HillaryClinton,“It’s a simple but powerful idea: We believe that we are stronger together.” —Hillary https://t.co/BpXIJZNcDy,False,,en
740710365735100420,HillaryClinton,A note from Hillary. https://t.co/LHSZvl7ODF,False,,en
740635388834893824,HillaryClinton,A headline 227 years in the making. https://t.co/7RDeQ3bQ3z https://t.co/IuHMa3tUTr,False,,en
740614762267090944,HillaryClinton,History. https://t.co/CkDyWA2Bfv https://t.co/hI52yd3ATf,False,,en
740602815261908992,HillaryClinton,Front pages from around the country on a big day. https://t.co/bNrJXn967S https://t.co/JA2R2R9drQ,False,,en
740595397622648833,HillaryClinton,"If Hillary could go back in time and tell anyone she'd been nominated for president, it would be her mom. https://t.co/LfcqMPQ0ST",False,,en
740564514228211712,HillaryClinton,"Let’s keep making history, together.
https://t.co/7IIvZVW3HY",False,,en
740526342974889988,HillaryClinton,"Thank you, California! https://t.co/EgtQpT6JZT",False,,en
740396544403378176,HillaryClinton,Don’t let anyone tell you that great things can’t happen in America. https://t.co/dtgjwmcfMm,False,,en
740389964882403328,HillaryClinton,"Don’t let anyone tell you great things can’t happen in America. Barriers can come down. Justice &amp; equality can win.
https://t.co/5xcwapDvPJ",False,,en
740382449566375936,HillaryClinton,Text CONGRATS to 47246 to tell Hillary you're proud to be by her side all the way to the White House. https://t.co/bBCd6SF3Vf,False,,en
740379623968608257,HillaryClinton,Thank you. https://t.co/JeMUyYFlzJ,False,,en
740375119684591616,HillaryClinton,We made history tonight—but we have more work to do. Chip in if you've got Hillary's back: https://t.co/iQy1FYwUkM,False,,en
740373403283099648,HillaryClinton,"""This campaign is about making sure there are no ceilings—no limits—on any of us."" —Hillary #ImWithHer https://t.co/HtFmnfoJxc",False,,en
740373188220178433,HillaryClinton,Wish Mom could have been here to see tonight. https://t.co/NalmZoKoV7,False,,en
