id,handle,text,is_retweet,original_author,lang
780925634159796224,HillaryClinton,The question in this election: Who can put the plans into action that will make your life better? https://t.co/XreEY9OicG,False,,en
780907038650068994,HillaryClinton,"If we stand together, there's nothing we can't do. 

Make sure you're ready to vote: https://t.co/tTgeqxNqYm https://t.co/Q3Ymbb7UNy",False,,en
780897419462602752,HillaryClinton,Both candidates were asked about how they'd confront racial injustice. Only one had a real answer. https://t.co/sjnEokckis,False,,en
780883582051123200,HillaryClinton,This election is too important to sit out. Go to https://t.co/tTgeqxNqYm and make sure you're registered. #NationalVoterRegistrationDay -H,False,,en
780881075891531776,HillaryClinton,When Donald Trump goes low...register to vote: https://t.co/tTgeqxNqYm https://t.co/DXz9dEwsZS,False,,en
780859420846727168,HillaryClinton,Donald Trump lied to the American people at least 58 times during the first presidential debate. (We counted.) https://t.co/h43O6Rws4S,False,,en
780852261442445312,HillaryClinton,"“She gained about 55 pounds in...9 months. She was like an eating machine.” —Trump, a man who wants to be president: https://t.co/1ht91eZCyw",False,,en
780840847256453120,HillaryClinton,It's #NationalVoterRegistrationDay. Celebrate by registering to vote → https://t.co/tTgeqxNqYm https://t.co/R6lVvgLECG,False,,en
780832403392790529,HillaryClinton,"""I love this country.
I’m proud of this country.
I want to be a leader who brings people together.""
—Hillary #LoveTrumpsHate",False,,en
780831901204484097,HillaryClinton,"We don’t want to turn against each other.
We want to work with one another.
We want to set big goals in this country.
#StrongerTogether",False,,en
780830984262516736,HillaryClinton,"""What we hear from my opponent is dangerously incoherent. It's unclear what he's saying, but words matter."" —Hillary",False,,en
780830729760485378,HillaryClinton,One candidate made it clear he wasn’t prepared for last night’s debate. The other made it clear she’s prepared to b… https://t.co/InYZBmnbBM,False,,en
780830087457406980,HillaryClinton,"""What kind of a person would want to root for 9 million families losing their homes?

One who should never be president."" —Hillary on Trump",False,,en
780828916919504896,HillaryClinton,"""I don’t think that any family should have to pay more than 10% of their income on child care.” —Hillary https://t.co/pepW0auI8n",False,,en
780828206039502848,HillaryClinton,"""I’m really glad my dad never had a contract with Donald Trump.” —Hillary https://t.co/un2YiRLEYF",False,,en
780827541670076416,HillaryClinton,"When you work hard, you should not be living in poverty. https://t.co/86sTOCAkkq",False,,en
780825360611086336,HillaryClinton,"""We may have a record-setting turnout in this election.

We could have the biggest turnout we've ever had."" https://t.co/tTgeqxNqYm",False,,en
780824346310877184,HillaryClinton,"""You can go to https://t.co/tTgeqxNqYm to make sure you are registered. And I hope you all will.” —Hillary #NationalVoterRegistrationDay",False,,en
780823097498796034,HillaryClinton,Join Hillary live in NC for her first rally since winning last night's debate → https://t.co/DzEpIDf7HY #NationalVoterRegistrationDay,False,,en
780816109700124672,HillaryClinton,"“Donald just criticized me for preparing for this debate. And you know what else I prepared for?

I prepared to be… https://t.co/QjB01msPaT",False,,en
780812840529723392,HillaryClinton,Hillary was the winner of the first presidential debate—and newspapers across America agree. #SheWon… https://t.co/oDiUHd0eXO,False,,en
780802294002647040,HillaryClinton,"""She gained a massive amount of weight...it was a real problem."" —Trump this morning on Alicia Machado https://t.co/LJPlFegSTs",False,,en
780797677009244160,HillaryClinton,"When you have a really, really good night. #SheWon https://t.co/FVeGqhYxRZ",False,,en
780794828007305217,HillaryClinton,"""Register. Vote. Go out and get engaged!” —@JoeBiden #NationalVoterRegistrationDay https://t.co/tTgeqxNqYm",False,,en
780792352214573057,HillaryClinton,"""I'm glad Trump found out that Crimea was part of Ukraine. By the way, I heard he was on the verge of acknowledging gravity."" —@JoeBiden",False,,en
780790673851224064,HillaryClinton,"“Let me tell you who built this damn country: the middle class.” —@JoeBiden

Let's keep building it, together: https://t.co/tTgeqxNqYm",False,,en
780787312460464129,HillaryClinton,One moment last night that proved—again—that Hillary's the only candidate ready to lead on the global stage: https://t.co/i4lrw7BpE9 #SheWon,False,,en
780782299524792320,HillaryClinton,"""Anyone who complains about microphone problems is not having a good night."" —Hillary #SheWon",False,,en
780768433910710272,HillaryClinton,"Trump on Alicia, 1996: ""Miss Piggy.""

This morning: ""She gained a massive amount of weight...it was a real problem."" https://t.co/0wrISjJe6z",False,,en
780746901591199744,HillaryClinton,"""I have a winning temperament."" —Donald Trump last night 

Really? #SheWon https://t.co/nMTFoISagO",False,,en
780738162880634880,HillaryClinton,Only one person on last night's stage is prepared to be Commander-in-Chief. Make sure she gets the chance:… https://t.co/o50AezGRrb,False,,en
780619128210087937,HillaryClinton,43 days left. Let’s go win this thing: https://t.co/vJShYQPqJb #DebateNight https://t.co/MzR30MEI0J,False,,en
780611407221960704,HillaryClinton,"Donald Trump called her ""Miss Piggy"" and ""Miss Housekeeping.""

Her name is Alicia Machado. #DebateNight https://t.co/0wrISjJe6z",False,,en
780602342890737664,HillaryClinton,The presidency isn't a reality show—it's as real as it gets. Make sure you're registered to vote:… https://t.co/gBZ42fzFnF,False,,en
780600557325156353,HillaryClinton,Text IMWITHHER to 47246 to tell Hillary you're on her team all the way to Election Day. #debatenight https://t.co/YzlkvzVTGY,False,,en
780599274384027648,HillaryClinton,RT this if you're proud to be standing with Hillary tonight. #debatenight https://t.co/91tBmKxVMs,False,,en
780598650628169729,HillaryClinton,Hillary just proved she's the only candidate who's ready to be president. Chip in now and let's go win this thing: https://t.co/ATqqxWU0Hc,False,,en
780597846814982144,HillaryClinton,"When Donald Trump says he has a ""winning temperament."" #debatenight https://t.co/ElQ7aG2vxu",False,,en
780597333650239488,HillaryClinton,The woman Trump called “Miss Piggy” has a name: Alicia. #debatenight https://t.co/XlthzE8X8j,False,,en
780596663345905664,HillaryClinton,"""When Donald Trump spends 11 hours testifying in front of a congressional committee, he can talk to me about stamina."" —Hillary #debatenight",False,,en
780595314210267137,HillaryClinton,"Donald Trump's ""cavalier attitude about nuclear weapons is so deeply troubling.” #DebateNight https://t.co/z66rUZz31J",False,,en
780594655318638592,HillaryClinton,.@realDonaldTrump: Barack Obama is your president too. #debatenight,False,,en
780594447427960833,HillaryClinton,A man who can be provoked by a tweet should not have his hands anywhere near the nuclear codes. #DebateNight,False,,en
780594312182657024,HillaryClinton,This should go without saying: Taking nuclear war lightly is disqualifying for anyone seeking to be President of th… https://t.co/OXigxJhmqJ,False,,en
780592331368128512,HillaryClinton,"""I hope the fact-checkers are turning up the volume. Donald Trump supported the invasion of Iraq.” https://t.co/CoyJtoyxd0",False,,en
780591277620551680,HillaryClinton,What is the deal with Donald Trump and Russia? https://t.co/xUYxOdoYo3 #debatenight,False,,en
780589899518967808,HillaryClinton,"When Donald Trump goes low, we go high. #DebateNight https://t.co/5MUlOMJqWM",False,,en
780589488271687681,HillaryClinton,"When a man is sued for discriminating against black tenants &amp; pushes birtherism, he's giving you an idea of what kind of president he'd be.",False,,en
780588840201388032,HillaryClinton,"Donald Trump's answer for his five years of pushing the racist birther conspiracy theory?

""I say nothing."" #debatenight",False,,en
780588262402424832,HillaryClinton,"""Trump just criticized me for preparing for this debate. You know what else I prepared for? Being president."" #DebateNight",False,,en
780588035805175808,HillaryClinton,President Obama was born in the United States. He’s American. Trump only has one reason for refusing to admit it. #debatenight,False,,en
780587655109181440,HillaryClinton,"Still a complete lie. #DebateNight 
https://t.co/F8aCfIqYWs",False,,en
780586814126034945,HillaryClinton,Donald Trump is more concerned with pandering to the gun lobby than keeping families safe. #DebateNight https://t.co/LspcUJNUc5,False,,en
780586553836003333,HillaryClinton,"The fact that Trump's answer to a question about racial injustice is just ""we need law and order"" pretty much says it all. #debatenight",False,,en
780586416476676098,HillaryClinton,We’ve got to address the systemic racism in our criminal justice system and end private prisons. #DebateNight https://t.co/8afCXJAAjI,False,,en
780585423764647936,HillaryClinton,We are not going to bring New York’s unconstitutional stop-and-frisk program nationwide. #debatenight,False,,en
780583951647768577,HillaryClinton,"""Maybe he didn't do a good job."" —Donald Trump

Looks like you “loved” it at the time. #DebateNight… https://t.co/LelC6Tb3nj",False,,en
780582940732424192,HillaryClinton,"""It's about time this country had somebody running it who has an idea about money."" —Trump #debatenight https://t.co/dpDrKCHVCd",False,,en
780582541019475968,HillaryClinton,"Paying zero in taxes doesn’t make you ""smart.""

It makes you a tax evader. https://t.co/g9nQkSRvTB",False,,en
780582086231126016,HillaryClinton,No wonder Donald Trump is hiding his tax returns. #debatenight https://t.co/gcvsadMwHJ,False,,en
780579514938261504,HillaryClinton,Donald Trump may live in his own reality—but we've got his own words right here. Check them out: https://t.co/NLPH8sbAGn #debatenight,False,,en
780578052216676352,HillaryClinton,"We can step up and confront climate change, save our planet, and invest in clean energy. 

Or, we can do nothing.… https://t.co/U29h8UaYZP",False,,en
780577643456565248,HillaryClinton,"""I never said that."" —Donald Trump, who said that. #debatenight https://t.co/6T8qV2HCbL",False,,en
780577456080166912,HillaryClinton,"""That's called business."" —Donald Trump on the housing crash.

For millions of Americans it was called ""losing their home."" #DebateNight",False,,en
780577128005963776,HillaryClinton,"Economists project that Trump’s plans would add more than $5,000,000,000,000 to the national debt. That's ""trillion"" with a ""T.""",False,,en
780576523040489472,HillaryClinton,"Every time Trump makes a show of railing against outsourcing, remember the countries he shipped jobs and profits to: https://t.co/5MZTsOgYR9",False,,en
780576124023762944,HillaryClinton,"Having a small business owner for a dad may not get you multi-million-dollar bailouts, but it does teach you the va… https://t.co/3LV3pmjRBI",False,,en
780575611085582336,HillaryClinton,There's only one candidate on stage who will support working families. #DebateNight https://t.co/uOV7JC9uQC,False,,en
780575331996532737,HillaryClinton,"We have to build an economy that works for everyone, not just those at the top. #DebateNight https://t.co/XPTvh4Dovf",False,,en
780573935582707712,HillaryClinton,Watch live: Hillary takes the stage for the first presidential debate → https://t.co/FbmDLQp03w #DebateNight,False,,en
780570465681235968,HillaryClinton,Let's do this. #DebateNight https://t.co/NkPEGHzucT,False,,en
780565409623924736,HillaryClinton,"If you're with Hillary, now's the time to show it. Chip in before tonight's debate to have her back: https://t.co/OftmbqRvyQ #DebateNight",False,,en
780557354748129280,HillaryClinton,"No matter what Donald says at tonight's debate, we already know the real Trump.

Follow @TheBriefing2016 for the fa… https://t.co/ueK4tWWMN0",False,,en
780551112386633728,HillaryClinton,"Hillary’s set to take the debate stage at 9pm ET.

Here's where you can watch: https://t.co/DhwVYhlA6K #DebateNight https://t.co/gMJINu5xJi",False,,en
780540877047341057,HillaryClinton,"“You didn’t blame Little John or Meat Loaf. You fired Gary Busey.

These are the kinds of decisions that would keep… https://t.co/RT0cARwsu7",False,,en
780527183030849536,HillaryClinton,Here are 35 questions Trump still needs to answer. https://t.co/rdMYbHGhwA #DebateNight,False,,en
780504737980485632,HillaryClinton,Watch this before you watch tonight's debate. #DebateNight https://t.co/vnC4bMrS0Q,False,,en
780495540521955329,HillaryClinton,"Trump told 31 outright lies just last week.

Keep him honest at tonight's debate: Follow @TheBriefing2016 to get th… https://t.co/m1WyJ3DJqF",False,,en
780485304276881412,HillaryClinton,"""Our presidents are role models for generations of our children. Is this the example we want for them?"" —@NYTimes… https://t.co/lQRruBpQfB",False,,en
780468127322738688,HillaryClinton,"These headlines on Trump's lies are from just one week of his campaign.

Imagine four years of his presidency. https://t.co/FE1hZ7MmR6",False,,en
780461537932771328,HillaryClinton,Everything you need to know before watching tonight's debate: https://t.co/Z4gcpSDfZa https://t.co/bymTtB2Et7,False,,en
780446051992043521,HillaryClinton,"Tonight, Hillary will debate Trump for the first time. Follow @TheBriefing2016 to make sure he's held accountable to the facts. #DebateNight",False,,en
780439472009801728,HillaryClinton,A reminder heading into tonight's debate. #DebateNight https://t.co/TwsbBNPOZP,False,,en
780431767710928897,HillaryClinton,"""Donald Trump is a man who dwells in bigotry, bluster and false promises."" —@NYTimes https://t.co/dGBX93R3PK #DebateNight",False,,en
780414643516780544,HillaryClinton,Our daughters deserve better. https://t.co/LJPlFegSTs,False,,en
780394697068048384,HillaryClinton,Not a single living president has endorsed Donald Trump. https://t.co/nGXxXTo3NI,False,,en
780386445844422656,HillaryClinton,Trump can't win tonight's debate by lying to the American people. https://t.co/uRkyip3Rfe,False,,en
780377725328625664,HillaryClinton,RT this if you've got Hillary's back tonight. #Debates2016 https://t.co/r66XZWiNJL,False,,en
780214115088240640,HillaryClinton,"When we come together, there's no problem we can't solve and no divide we can't heal. https://t.co/2eutCA4R6C",False,,en
780207878229598208,HillaryClinton,"Today, the sacrifices of Gold Star families weigh heavier on my mind. Thank you. I will fight to get you the care &amp; benefits you deserve. -H",False,,en
780169819379343364,HillaryClinton,"59 years ago, 9 brave students integrated Central High School, changing the course of history. Let's recommit to fi… https://t.co/wzF4WRU5IS",False,,en
780167921746210816,HillaryClinton,Let's send Donald Trump—and the world—a clear message. https://t.co/tTgeqxNqYm #LoveTrumpsHate https://t.co/0VI8zmXgZE,False,,en
780152733240135681,HillaryClinton,Imagine Donald Trump sitting in the Situation Room making life or death decisions on behalf of the United States. https://t.co/YFraVXr5Zf,False,,en
780133767063146497,HillaryClinton,"""[Hillary] is one of the most qualified people ever to run for the office, and she easily earns our endorsement.”… https://t.co/AhBE0UuJPO",False,,en
780122716338651136,HillaryClinton,Our veterans and their families deserve a president who doesn't disrespect and disparage their sacrifices. https://t.co/sMGa9bxZGX,False,,en
780107005793071104,HillaryClinton,7 ways Hillary's policies would help you in your daily life: https://t.co/f7oDXlVyx6,False,,en
780081425714335747,HillaryClinton,Gold Star families have made sacrifices most of us can't even fathom. They deserve our respect and our thanks. https://t.co/c9gDHudBjt,False,,en
780064257631289344,HillaryClinton,Not one living president has said they believe Donald Trump has what it takes to be Commander-in-Chief. https://t.co/3HeTtkQ6KS,False,,en
780047067389517824,HillaryClinton,Meet three women who inspired Hillary to become the person she is today: https://t.co/1O4rw3ecBH https://t.co/Df9X0o5E6h,False,,en
780030623247392768,HillaryClinton,"""Our endorsement is rooted in respect for her intellect, experience, toughness and courage."" —@NYTimes on Hillary… https://t.co/ihdRZdqGva",False,,en
779830115643617280,HillaryClinton,"The new @NMAAHC is an overdue tribute to African American history. Let's build a more open, inclusive future by reflecting on our past. -H",False,,en
779817238346002432,HillaryClinton,"""Our choice, Hillary Clinton, has a record of service and a raft of pragmatic ideas."" —@NYTimes endorsing Hillary… https://t.co/7Sus2PxlWC",False,,en
779801578723217408,HillaryClinton,"""I thought, this woman—I want to ride with her."" —Roxie, a Republican and small business owner, on meeting Hillary https://t.co/s5zyaOBLXB",False,,en
779788945953591296,HillaryClinton,Hillary's been fighting for women and girls her entire career—and she's just getting started. https://t.co/NMnrgEzNkT,False,,en
779767715040989184,HillaryClinton,"""A lifetime’s commitment to solving problems in the real world qualifies Hillary Clinton for this job."" —@NYTimes https://t.co/qaswl7IOOJ",False,,en
779756206231617536,HillaryClinton,We know all too well who Donald Trump is. Let's make sure he never becomes president: https://t.co/tTgeqxNqYm https://t.co/3lJjQEQ0BR,False,,en
779734296160530432,HillaryClinton,"RT if you believe that #LoveTrumpsHate

Then make sure you're registered to vote: https://t.co/tTgeqxNqYm https://t.co/TlXODnaV53",False,,en
779703224458743808,HillaryClinton,Donald Trump doesn't see people like Anastasia—he only sees disability. https://t.co/0aDgpwHtjv,False,,en
779502695187148800,HillaryClinton,"""Hillary Clinton is one of the best prepared candidates to seek the presidency."" —@LATimes https://t.co/NG1am536OS",False,,en
779473882910720000,HillaryClinton,"If the young women of this country have Donald Trump as their president, what will they think of themselves? https://t.co/1IrjWddzzy",False,,en
779464482984697856,HillaryClinton,Republicans are once again turning their backs on the people of Flint who have waited far too long for help. It's w… https://t.co/sYyqDHAVXp,False,,en
779455891586314240,HillaryClinton,"""I was just blown away by this 9-year-old girl."" —Hillary on meeting disability rights advocate @AnastasiaSomoza https://t.co/nrjcqfGiRe",False,,en
779445994987610112,HillaryClinton,"""Donald Trump committed perjury. Or he looked into the faces of the Republican faithful and knowingly lied."" https://t.co/enl4NTjdX4",False,,en
779424632168411136,HillaryClinton,"""Hillary Clinton would make a sober, smart and pragmatic president. Donald Trump would be a catastrophe."" —@LATimes https://t.co/NG1am536OS",False,,en
779399176564113408,HillaryClinton,Addiction is a disease—not a moral failing. We should support those who are struggling with it. #OpioidAwarenessWeek https://t.co/V9Uz3jVEjN,False,,en
779390581369864192,HillaryClinton,Charlotte should release police video of the Keith Lamont Scott shooting without delay. We must ensure justice &amp; work to bridge divides. -H,False,,en
779362039839887360,HillaryClinton,"""She gives us hope for the future. She's our girl.""  —Roxie, co-owner of @MercersDairy, on Hillary https://t.co/s5zyaOBLXB",False,,en
779320180891615232,HillaryClinton,"When Donald Trump speaks about women, our daughters can hear him. https://t.co/0r1N6R8rV6",False,,en
779288660067823616,HillaryClinton,Is this the president we want for our daughters? https://t.co/GP4rfhPDGm,False,,en
779153070118752256,HillaryClinton,"""He's 70 years old, and he's still a bully."" —Karen on @realDonaldTrump https://t.co/XBCJ4mTj24",False,,en
779145074831663105,HillaryClinton,Our favorite moments from Hillary's appearance on Between Two Ferns → https://t.co/tXLPQtR7tb https://t.co/Er2YqHQVhl,False,,en
779106750133837824,HillaryClinton,"""I really regret doing this."" —Hillary on Between Two Ferns https://t.co/OmDyINNCrW",False,,en
779094002805182464,HillaryClinton,Let's make sure nobody who works full-time in America has to live in poverty. https://t.co/mpGBCNlemA https://t.co/fCcXd1MrTo,False,,en
779066671067762692,HillaryClinton,Donald Trump's ties to Russia may conflict with America's interests—but they're great for his bottom line. https://t.co/gYbm5HxfxG,False,,en
779058340315951104,HillaryClinton,Very concerned about the outage in Puerto Rico and the millions of families who don't have power. Hoping it's resto… https://t.co/Y2oG1CS2AN,False,,en
779055195607166977,HillaryClinton,The man who could be your next president may be deeply indebted to another country. Do you trust him to run ours? https://t.co/5TU9olTqd5,False,,en
779038725128855552,HillaryClinton,"Most people who are bullies grow out of it. 

Donald Trump hasn't. https://t.co/tEJ9ATm9BS",False,,en
779016565475962882,HillaryClinton,"""Donald Trump doesn't see people like me, he only sees disability. I honestly feel bad for someone with so much hat… https://t.co/NTeF9u8JpN",False,,en
779006874708475904,HillaryClinton,"""I think this is the most important election in my lifetime."" @ChelseaClinton takes the 🎤 in this week's podcast: https://t.co/dAwaE8Dg0C",False,,en
778985572215955456,HillaryClinton,"Donald Trump is really good at spending other people's money—on:

Legal settlements.
Payoffs.
Portraits of himself. https://t.co/C5bXw5brI9",False,,en
778772872659628033,HillaryClinton,Trump should have to answer exactly why he refuses to believe that @POTUS is American. https://t.co/NReJ3wJE8l,False,,en
778760862169440256,HillaryClinton,"No child should ever have to grow up in poverty, yet far too many do. We have to do better. Here's how: https://t.co/Qo1RmQDwd6",False,,en
778755177310486528,HillaryClinton,"""You would think there is almost, like, something wrong."" —Donald Trump on Mitt Romney failing to release his tax r… https://t.co/VzUQByCN2A",False,,en
778747606864306176,HillaryClinton,Going to bat for kids who are too often counted out has always been a priority for Hillary. https://t.co/lTxRVn3NBM,False,,en
778731850302758912,HillaryClinton,".@TimKaine is more than just a great running mate—he's a great guy to have as a friend, too. https://t.co/5WX2qYgUjC",False,,en
778713373873700864,HillaryClinton,We need a president who sees the best in all of us. https://t.co/vX0Oycto1Q,False,,en
778682662781227008,HillaryClinton,"A disability shouldn't define your future.

At @ChildDefender, Hillary helped give kids the chance to succeed. https://t.co/jaMcdARYn1",False,,en
778673342404501504,HillaryClinton,"We believe that everyone has value.
We believe that everyone's created equal.
We believe that love trumps hate.
https://t.co/tTgeqxNqYm",False,,en
778672847610839040,HillaryClinton,We'll make our economy and country more welcoming to people with disabilities. We all win when everyone gets to share in America's promise.,False,,en
778672424128811009,HillaryClinton,"The ultimate test of our society is how we treat our fellow human beings, especially those who we have previously left behind.",False,,en
778671551298297856,HillaryClinton,Americans with disabilities deserve the chance to work alongside those without disabilities—to do the same jobs for the same pay &amp; benefits.,False,,en
778671261819994113,HillaryClinton,"We’ve got to build an economy that welcomes people with disabilities, values their work, rewards them fairly, and treats them with respect.",False,,en
778670985516048384,HillaryClinton,Over 60% of adults with disabilities aren’t in the workplace. We have to fix that. https://t.co/J3Jq21ejtR,False,,en
778670110319972353,HillaryClinton,None of us gets through life alone. We all have to look out for each other and lift each other up.,False,,en
778667640646696960,HillaryClinton,"Building an inclusive economy is another reason we’ve got to break down systemic racism, including under-investment in communities of color.",False,,en
778667376686559232,HillaryClinton,"When we leave people out or write them off, we not only shortchange them and their dreams, we shortchange our country and our future.",False,,en
778666930781691905,HillaryClinton,"In America, every person, no matter what you look like or who you are, should have the chance to go as far as your dreams will take you.",False,,en
778666439540633600,HillaryClinton,"We need to come together to turn the tide, stop violence, build trust, and give all our kids the chance to grow up safe and healthy.",False,,en
778666108853313536,HillaryClinton,We've also seen the targeting of police officers—but so many serve every day with courage and honor and are committed to reform.,False,,en
778665779906670592,HillaryClinton,"We have two names to add to a long list of African Americans killed by police officers. It’s unbearable, and it needs to become intolerable.",False,,en
778665476071260160,HillaryClinton,Live from Orlando: Watch Hillary share her plan for building an inclusive economy that helps everyone get ahead → https://t.co/IX06FtcZG8,False,,en
778644136954036224,HillaryClinton,Every student should be able to graduate from college without taking on any debt. https://t.co/1aWqDOKh7p https://t.co/KHguTDbKW9,False,,en
778604976516001796,HillaryClinton,Keith Lamont Scott. Terence Crutcher. Too many others. This has got to end. -H,False,,en
778431365884833792,HillaryClinton,"Have student debt? 
Planning for college?
See how much money Hillary's plan would save you:
https://t.co/fiXgr6S3Ye https://t.co/B8PCks6yXL",False,,en
